Name,Price,Score,Description,Cleaned_Description
The Vintage Rentals,2086,6.7,"Estos elegantes apartamentos están situados en el centro de Barcelona, justo en la esquina del famoso paseo de Gràcia. Tienen conexión Wi-Fi gratuita, TV de pantalla plana y balcón privado.

Los apartamentos del Vintage Rentals tienen aire acondicionado, suelos de parquet y una decoración moderna. La cocina dispone de vitrocerámica, microondas, lavadora y lavavajillas.

Los apartamentos se encuentran a 3 minutos a pie de la estación de metro Diagonal. The Vintage Rentals está a 5 minutos andando de la famosa Pedrera y a un paseo de 10 minutos de la Casa Batlló, ambas diseñadas por Gaudí. El establecimiento ofrece un servicio de traslado al aeropuerto de Barcelona, situado a 25 minutos en coche.",elegant apartamento situado centro barcelona justo esquina famoso paseo gràcia conexión gratuita tv pantalla plana balcón privado apartamento vintag rental air acondicionado suelo parquet decoración moderna cocina dispon vitrocerámica microonda lavadora lavavajilla apartamento encuentran 3 minuto pie estación metro diagon the vintag rental 5 minuto andando famosa pedrera paseo 10 minuto casa batlló amba diseñada gaudí establecimiento ofrec servicio traslado aeropuerto barcelona situado 25 minuto coch
Hotel Everest,1563,8.1,"El Hotel Everest está situado a 10 minutos a pie de la impresionante catedral de la Sagrada Familia y cuenta con terraza en la azotea y WiFi gratuita.

Las amplias habitaciones del Hotel Everest incluyen aire acondicionado y TV vía satélite. Cuentan con baño moderno, y algunas tienen balcón.

El alojamiento presta servicio de enlace con el aeropuerto en ambas direcciones y de traslado a otras zonas de la ciudad, por un suplemento. El hotel también dispone de máquina expendedora de café y refrescos.

El hotel se encuentra junto al hospital de Sant Pau, un impresionante edificio modernista. El centro de la ciudad está a menos de 15 minutos en metro. La estación de metro de Sant Pau se halla a 200 metros. Hay aparcamiento privado disponible en las inmediaciones por un suplemento. El personal de recepción puede ofrecer más información.",hotel everest situado 10 minuto pie impresionant catedr sagrada familia cuenta terraza azotea wifi gratuita amplia habitacion hotel everest incluyen air acondicionado tv vía satélit cuentan baño moderno balcón alojamiento presta servicio enlac aeropuerto amba direccion traslado zona ciudad suplemento hotel dispon máquina expendedora café refresco hotel encuentra junto hospit sant pau impresionant edificio modernista centro ciudad meno 15 minuto metro estación metro sant pau halla 200 metro aparcamiento privado dispon inmediacion suplemento person recepción pued ofrec información
Catalonia La Maquinista,1268,8.4,"El Catalonia La Maquinista está ubicado en Barcelona, en el barrio de Sant Andreu, junto al centro comercial La Maquinista. La plaza de Cataluña está a solo 15 minutos en metro.

Las habitaciones del Maquinista son luminosas y disponen de aire acondicionado y TV inteligente de pantalla plana con la aplicación Chromecast. Todas las habitaciones están equipadas con escritorio y caja fuerte. Hay WiFi gratuita en todo el hotel.

El restaurante del hotel sirve un desayuno buffet y cocina mediterránea para el almuerzo y la cena. El cercano centro comercial La Maquinista cuenta con varios cines, una bolera, cafeterías y bares.

El Catalonia La Maquinista se halla a 500 metros de la carretera de circunvalación de Barcelona, la B10 Ronda del Litoral, que conecta con la playa en 10 minutos.

El Catalonia La Maquinista se encuentra a solo 10 minutos a pie de la estación de metro y tren de Sant Andreu, que ofrece conexiones directas con el paseo de Gracia y el aeropuerto de El Prat. La plaza de Cataluña y Las Ramblas quedan a 8 paradas de metro.

Las reservas de más de 4 habitaciones o de más de 8 noches están sujetas a condiciones y suplementos especiales.",catalonia maquinista ubicado barcelona barrio sant andreu junto centro comerci maquinista plaza cataluña solo 15 minuto metro habitacion maquinista luminosa disponen air acondicionado tv inteligent pantalla plana aplicación chromecast toda habitacion equipada escritorio caja fuert wifi gratuita hotel restaurant hotel sirv desayuno buffet cocina mediterránea almuerzo cena cercano centro comerci maquinista cuenta vario cine bolera cafetería bare catalonia maquinista halla 500 metro carretera circunvalación barcelona b10 ronda litor conecta playa 10 minuto catalonia maquinista encuentra solo 10 minuto pie estación metro tren sant andreu ofrec conexion directa paseo gracia aeropuerto prat plaza cataluña rambla quedan 8 parada metro reserva 4 habitacion 8 noch sujeta condicion suplemento especial
Comfortable 3BD in Poblenou next to the beach!,2141,7.8,"Comfortable 3BD in Poblenou next to the beach! se encuentra en el barrio de Sant Martí, en Barcelona, a 10 min a pie de Platja de la Nova Icària y a 1,2 km de Platja del Bogatell, y ofrece alojamiento equipado con patio y wifi gratis. Este apartamento está a 1,7 km de Museo Picasso y a 3,1 km de Sagrada Familia.

Este apartamento tiene aire acondicionado y cuenta con 2 dormitorios, TV y cocina con nevera y horno.

Cerca del alojamiento hay puntos de interés como Platja del Somorrostro, Port Olimpic y Santa María del Mar. El aeropuerto (Aeropuerto de Barcelona - El Prat) está a 14 km.",comfort 3bd in poblen next to the beach encuentra barrio sant martí barcelona 10 min pie platja nova icària km platja bogatel ofrec alojamiento equipado patio wifi grati apartamento km museo picasso km sagrada familia apartamento air acondicionado cuenta 2 dormitorio tv cocina nevera horno cerca alojamiento punto interé platja somorrostro port olimp santa maría mar aeropuerto aeropuerto barcelona prat 14 km
Catalonia Mikado,1227,8.1,"Este elegante hotel está situado en el exclusivo barrio de Sarrià y alberga una terraza jardín con piscina al aire libre y bañera de hidromasaje. Las habitaciones son funcionales y cuentan con aire acondicionado, TV vía satélite, nevera pequeña con agua gratuita y WiFi gratuita.

El restaurante del Catalonia Mikado está especializado en platos internacionales y sirve desayunos y cenas. El establecimiento también alberga un bar y se encuentra a 500 metros del encantador centro de Sarrià, famoso por sus pastelerías.

El Catalonia Mikado se halla a 10 minutos a pie de la Universidad Ramon Llull y de la Universidad Internacional de Cataluña. También está cerca de algunos de los centros médicos más importantes de Barcelona, como el centro Teknon, el IMO y el Institut Català de Retina.

El alojamiento queda a solo 10 minutos a pie de la estación de tren de Sarrià, que permite llegar al centro de Barcelona en 5 minutos.",elegant hotel situado exclusivo barrio sarrià alberga terraza jardín piscina air libr bañera hidromasaj habitacion funcional cuentan air acondicionado tv vía satélit nevera pequeña agua gratuita wifi gratuita restaurant catalonia mikado especializado plato internacional sirv desayuno cena establecimiento alberga bar encuentra 500 metro encantador centro sarrià famoso pastelería catalonia mikado halla 10 minuto pie universidad ramon llull universidad internacion cataluña cerca centro médico important barcelona centro teknon imo institut català retina alojamiento queda solo 10 minuto pie estación tren sarrià permit llegar centro barcelona 5 minuto
Akira Flats Urgell apartment,2363,8.7,"Akira Flats Urgell apartment está en el barrio de Eixample, en Barcelona, a 18 min a pie de Estación de tren de Sants y a 1,4 km de Paseo de Gracia, y ofrece alojamiento equipado con balcón y wifi gratis. Este apartamento se encuentra en un edificio de 1900 y está a 16 min a pie de Casa Batlló y a 2,3 km de Fuente Mágica de Montjuïc.

Este apartamento con aire acondicionado consta de 2 dormitorios, una sala de estar, una cocina totalmente equipada con nevera y cafetera, y 1 baño con bidet y ducha. Hay toallas y ropa de cama en el apartamento.

Cerca del alojamiento hay puntos de interés como La Pedrera, Plaza Cataluña y Estación de metro Passeig de Gràcia. El aeropuerto (Aeropuerto de Barcelona - El Prat) está a 12 km.",akira flat urgel apart barrio eixampl barcelona 18 min pie estación tren sant km paseo gracia ofrec alojamiento equipado balcón wifi grati apartamento encuentra edificio 1900 16 min pie casa batlló km fuent mágica montjuïc apartamento air acondicionado consta 2 dormitorio sala cocina totalment equipada nevera cafetera 1 baño bidet ducha toalla ropa cama apartamento cerca alojamiento punto interé pedrera plaza cataluña estación metro passeig gràcia aeropuerto aeropuerto barcelona prat 12 km
Poblenou renovated 3BD next to the beach,2386,8.7,"Poblenou renovated 3BD next to the beach se encuentra en el barrio de Sant Martí, en Barcelona, a 10 min a pie de Platja de la Nova Icària y a 1,2 km de Platja del Bogatell, y ofrece alojamiento equipado con patio y wifi gratis. Este apartamento está a 1,7 km de Museo Picasso y a 3,1 km de Sagrada Familia.

Este apartamento tiene aire acondicionado y cuenta con 3 dormitorios, TV y cocina con nevera y horno.

Cerca del alojamiento hay puntos de interés como Platja del Somorrostro, Port Olimpic y Santa María del Mar. El aeropuerto (Aeropuerto de Barcelona - El Prat) está a 14 km.",poblen renov 3bd next to the beach encuentra barrio sant martí barcelona 10 min pie platja nova icària km platja bogatel ofrec alojamiento equipado patio wifi grati apartamento km museo picasso km sagrada familia apartamento air acondicionado cuenta 3 dormitorio tv cocina nevera horno cerca alojamiento punto interé platja somorrostro port olimp santa maría mar aeropuerto aeropuerto barcelona prat 14 km
Palau de la música 2,1708,5.7,"Palau de la música 2 es un alojamiento con una ubicación ideal en el centro de Barcelona que ofrece balcón. Este apartamento ofrece wifi gratis y está a 1,9 km de Platja de la Barceloneta y a 1,9 km de Platja del Somorrostro.

Este apartamento se compone de 2 dormitorios independientes, una cocina totalmente equipada y 1 baño. Hay TV de pantalla plana.

Cerca del alojamiento hay puntos de interés como Catedral de Barcelona, Palacio de la Música Catalana y Paseo de Gracia. El aeropuerto (Aeropuerto de Barcelona - El Prat) está a 13 km.",palau música 2 alojamiento ubicación ideal centro barcelona ofrec balcón apartamento ofrec wifi grati km platja barceloneta km platja somorrostro apartamento compon 2 dormitorio independient cocina totalment equipada 1 baño tv pantalla plana cerca alojamiento punto interé catedr barcelona palacio música catalana paseo gracia aeropuerto aeropuerto barcelona prat 13 km
Aparthotel Mariano Cubi Barcelona,2206,8.3,"El Aparthotel Mariano Cubi se encuentra a solo 200 metros de la avenida Diagonal y a 15 minutos a pie del paseo de Gràcia de Barcelona. Ofrece habitaciones con aire acondicionado y conexión WiFi gratuita, y algunas de ellas tienen zona de cocina.

Las habitaciones son amplias y cuentan con suelo de madera, TV vía satélite y escritorio. A la llegada, el establecimiento recibe a los huéspedes con una copa de cava gratuita.

El Aparthotel Mariano Cubi facilita servicio de información turística acerca de Barcelona. También hay un centro de negocios de acceso gratuito con conexión a internet.

La zona alberga una gran variedad de tiendas. El establecimiento está a unos 500 metros de la estación de metro Fontana y a solo 150 metros de la estación de FGC de Gràcia, desde donde se puede llegar fácilmente a la plaza de Cataluña y a Las Ramblas. La Pedrera de Gaudí queda a unos 20 minutos a pie.",aparthotel mariano cubi encuentra solo 200 metro avenida diagon 15 minuto pie paseo gràcia barcelona ofrec habitacion air acondicionado conexión wifi gratuita zona cocina habitacion amplia cuentan suelo madera tv vía satélit escritorio llegada establecimiento recib huésped copa cava gratuita aparthotel mariano cubi facilita servicio información turística acerca barcelona centro negocio acceso gratuito conexión internet zona alberga gran variedad tienda establecimiento 500 metro estación metro fontana solo 150 metro estación fgc gràcia pued llegar fácilment plaza cataluña rambla pedrera gaudí queda 20 minuto pie
Casa Balmes,1612,8.6,"La Casa Balmes es un bed and breakfast con conexión Wi-Fi gratuita situado en pleno centro de Barcelona, a 400 metros de la conocida avenida Passeig de Gràcia y de monumentos como la Casa Batlló.

Las habitaciones de la Casa Balmes están insonorizadas, presentan una decoración elegante y disponen de aire acondicionado, TV de pantalla plana HD, minibar, caja fuerte gratuita y baño privado con secador de pelo y artículos de aseo gratuitos. La ropa de cama y las toallas están incluidas. Algunas habitaciones tienen vistas a la calle.

La Casa Balmes cuenta con terraza y salón compartido con máquinas expendedoras. Todos los días se sirve un desayuno que incluye zumos de fruta, café, té, tostadas, mermeladas, cereales y una selección de bollería.

El alojamiento cuenta con servicio de información turística, consigna de equipaje y servicio de lavandería. Los huéspedes pueden encontrar un centro deportivo con gimnasio y spa a solo 80 metros del B&B.

La Casa Balmes se encuentra a 8 minutos a pie de la plaza de Cataluña y a menos de 20 minutos en coche del aeropuerto de Barcelona El Prat.",casa balm bed and breakfast conexión gratuita situado pleno centro barcelona 400 metro conocida avenida passeig gràcia monumento casa batlló habitacion casa balm insonorizada presentan decoración elegant disponen air acondicionado tv pantalla plana hd minibar caja fuert gratuita baño privado secador pelo artículo aseo gratuito ropa cama toalla incluida habitacion vista call casa balm cuenta terraza salón compartido máquina expendedora día sirv desayuno incluy zumo fruta café té tostada mermelada cereal selección bollería alojamiento cuenta servicio información turística consigna equipaj servicio lavandería huésped pueden encontrar centro deportivo gimnasio spa solo 80 metro b b casa balm encuentra 8 minuto pie plaza cataluña meno 20 minuto coch aeropuerto barcelona prat
Hg City Suites Barcelona Apartments,1986,8.8,"Hg City Suites Barcelona Apartments se encuentra en Barcelona, cerca de Paseo de Gracia, La Pedrera, y Casa Batlló. Dispone de wifi gratis y salón de uso común.

El alojamiento tiene aire acondicionado, cocina totalmente equipada, TV de pantalla plana y baño privado con ducha, artículos de aseo gratuitos y secador de pelo.

El apartamento ofrece servicio de alquiler de coches.

Estación de metro Passeig de Gràcia está a 2,5 km del alojamiento, y Plaza Cataluña está a 2,5 km. El aeropuerto (Aeropuerto de Barcelona - El Prat) está a 14 km.",hg citi suit barcelona apart encuentra barcelona cerca paseo gracia pedrera casa batlló dispon wifi grati salón uso común alojamiento air acondicionado cocina totalment equipada tv pantalla plana baño privado ducha artículo aseo gratuito secador pelo apartamento ofrec servicio alquil coch estación metro passeig gràcia km alojamiento plaza cataluña km aeropuerto aeropuerto barcelona prat 14 km
Private rooms Born neighborhood,998,7.6,"Private rooms Born neighborhood se encuentra en el centro de Barcelona, a 1,9 km de Platja del Somorrostro, ydispone de habitaciones con aire acondicionado y wifi gratis. El alojamiento está cerca de varios lugares de interés destacados, a unos 9 min a pie de Paseo de Gracia, a 400 metros de Palacio de la Música Catalana y a 9 min a pie de Teatro Tívoli. Este alojamiento libre de humo está a 2 km de Platja de la Barceloneta.

Las habitaciones de este alojamiento están equipadas con hervidor. Todas las habitaciones tienen baño compartido, secador de pelo y ropa de cama.

Cerca del alojamiento hay puntos de interés como Estación de metro Passeig de Gràcia, Catedral de Barcelona y Plaza Cataluña. El aeropuerto (Aeropuerto de Barcelona - El Prat) está a 13 km.",privat room born neighborhood encuentra centro barcelona km platja somorrostro ydispon habitacion air acondicionado wifi grati alojamiento cerca vario lugar interé destacado 9 min pie paseo gracia 400 metro palacio música catalana 9 min pie teatro tívoli alojamiento libr humo 2 km platja barceloneta habitacion alojamiento equipada hervidor toda habitacion baño compartido secador pelo ropa cama cerca alojamiento punto interé estación metro passeig gràcia catedr barcelona plaza cataluña aeropuerto aeropuerto barcelona prat 13 km
Splash,2022,8.1,"Splash se encuentra en el barrio de Sant Martí, en Barcelona, cerca de Platja de la Nova Mar Bella. Dispone de wifi gratis y lavadora. Este apartamento está a 5 min a pie de Playa de la Mar Bella y a 600 metros de Platja de Llevant.

Este apartamento tiene 1 dormitorio, cocina con nevera y horno, TV de pantalla plana, zona de estar y 1 baño con ducha. Hay toallas y ropa de cama en el apartamento.

Port Olimpic está a 3,6 km del alojamiento, y Sagrada Familia está a 3,8 km. El aeropuerto más cercano (Aeropuerto de Barcelona - El Prat) está a 17 km.",splash encuentra barrio sant martí barcelona cerca platja nova mar bella dispon wifi grati lavadora apartamento 5 min pie playa mar bella 600 metro platja llevant apartamento 1 dormitorio cocina nevera horno tv pantalla plana zona 1 baño ducha toalla ropa cama apartamento port olimp km alojamiento sagrada familia km aeropuerto cercano aeropuerto barcelona prat 17 km
Vibrant and modern apartment,2256,7.8,"Vibrant and modern apartment se encuentra en Barcelona, a 15 min a pie de Fuente Mágica de Montjuïc y a 3,1 km de Plaza Cataluña, y ofrece alojamiento con aire acondicionado, balcón y wifi gratis. Está a 1,9 km de Portal del Ángel y ofrece servicio de conserjería.

El apartamento dispone de 2 dormitorios, TV de pantalla plana con canales vía satélite, una cocina equipada con nevera y microondas, y 1 baño con bañera o ducha. Hay toallas y ropa de cama en el apartamento.

Cerca del alojamiento hay puntos de interés como Palau Sant Jordi, Mercado de la Boquería y Montjuïc. El aeropuerto (Aeropuerto de Barcelona - El Prat) está a 12 km.",vibrant and modern apart encuentra barcelona 15 min pie fuent mágica montjuïc km plaza cataluña ofrec alojamiento air acondicionado balcón wifi grati km portal ángel ofrec servicio conserjería apartamento dispon 2 dormitorio tv pantalla plana canal vía satélit cocina equipada nevera microonda 1 baño bañera ducha toalla ropa cama apartamento cerca alojamiento punto interé palau sant jordi mercado boquería montjuïc aeropuerto aeropuerto barcelona prat 12 km
64 Apartment in a typical Barcelona's old building,2439,8.1,"64 Apartment in a typical Barcelona's old building, que tiene vistas a la ciudad, dispone de alojamiento con balcón y hervidor, y está a unos 15 min a pie de Fuente Mágica de Montjuïc. Plaza Cataluña y Portal del Ángel están a 3,1 km y a 1,9 km del apartamento, y hay wifi gratis.

Este apartamento con aire acondicionado consta de 2 dormitorios, una sala de estar, una cocina totalmente equipada con nevera y cafetera, y 1 baño con ducha y artículos de aseo gratuitos. Hay toallas y ropa de cama en el apartamento.

Cerca del alojamiento hay puntos de interés como Palau Sant Jordi, Mercado de la Boquería y Montjuïc. El aeropuerto (Aeropuerto de Barcelona - El Prat) está a 12 km.",64 apart in typic barcelona old build vista ciudad dispon alojamiento balcón hervidor 15 min pie fuent mágica montjuïc plaza cataluña portal ángel km km apartamento wifi grati apartamento air acondicionado consta 2 dormitorio sala cocina totalment equipada nevera cafetera 1 baño ducha artículo aseo gratuito toalla ropa cama apartamento cerca alojamiento punto interé palau sant jordi mercado boquería montjuïc aeropuerto aeropuerto barcelona prat 12 km
Eixample Sagrada Familia Apartments II,1644,7.8,"El Eixample Sagrada Familia Aparments está situado a 250 metros de la Sagrada Familia de Barcelona y ofrece apartamentos con conexión Wi-Fi gratuita, aire acondicionado y vistas a la ciudad.

Este alojamiento elegante cuenta con decoración moderna, suelo de parquet y zona de estar amplia y luminosa con sofá, TV de pantalla plana con canales por cable y mesa de comedor.

La cocina está equipada con vitrocerámica, microondas, utensilios de cocina y lavadora. Las toallas y la ropa de cama están incluidas.

El Eixample Sagrada Familia Aparments II está a 250 metros de la estación de metro de Sagrada Familia, a 3 paradas de metro de La Pedrera y la Casa Batlló de Gaudí, y a 20 minutos en metro de la Plaça de Catalunya y las famosas Ramblas.",eixampl sagrada familia apar situado 250 metro sagrada familia barcelona ofrec apartamento conexión gratuita air acondicionado vista ciudad alojamiento elegant cuenta decoración moderna suelo parquet zona amplia luminosa sofá tv pantalla plana canal cabl mesa comedor cocina equipada vitrocerámica microonda utensilio cocina lavadora toalla ropa cama incluida eixampl sagrada familia apar ii 250 metro estación metro sagrada familia 3 parada metro pedrera casa batlló gaudí 20 minuto metro plaça catalunya famosa rambla
Centric Apartment Molino P3,1836,6.7,"Centric Apartment Molino P3 está en Barcelona, a 18 min a pie de Fuente Mágica de Montjuïc y a 1,7 km de Plaza Cataluña, y ofrece alojamiento con equipamiento como wifi gratis y TV de pantalla plana. Este apartamento está a 14 min a pie de Mercado de la Boquería y a 1,5 km de Catedral de Barcelona.

Este apartamento con aire acondicionado se compone de 2 dormitorios independientes, una cocina totalmente equipada con nevera y fogones, y 1 baño.

Cerca del alojamiento hay puntos de interés como Santa María del Mar, Portal del Ángel y Paseo de Gracia. El aeropuerto (Aeropuerto de Barcelona - El Prat) está a 11 km.",centric apart molino p3 barcelona 18 min pie fuent mágica montjuïc km plaza cataluña ofrec alojamiento equipamiento wifi grati tv pantalla plana apartamento 14 min pie mercado boquería km catedr barcelona apartamento air acondicionado compon 2 dormitorio independient cocina totalment equipada nevera fogon 1 baño cerca alojamiento punto interé santa maría mar portal ángel paseo gracia aeropuerto aeropuerto barcelona prat 11 km
Modern and bright apartment in Eixample 1-2,2054,8.6,"Modern and bright apartment in Eixample 1-2 se encuentra en el barrio de Eixample, en Barcelona, a 13 min a pie de Estación de tren de Sants y a 1,2 km de Fuente Mágica de Montjuïc, y ofrece alojamiento equipado con patio y wifi gratis. Este apartamento está a 2 km de Casa Batlló y a 2,6 km de Plaza Cataluña.

El apartamento tiene 2 dormitorios, TV y cocina totalmente equipada con nevera, horno, lavadora, microondas y fogones.

Estación de metro Passeig de Gràcia está a 2,7 km del alojamiento, y Teatro Tívoli está a 2,8 km. El aeropuerto (Aeropuerto de Barcelona - El Prat) está a 11 km.",modern and bright apart in eixampl encuentra barrio eixampl barcelona 13 min pie estación tren sant km fuent mágica montjuïc ofrec alojamiento equipado patio wifi grati apartamento 2 km casa batlló km plaza cataluña apartamento 2 dormitorio tv cocina totalment equipada nevera horno lavadora microonda fogon estación metro passeig gràcia km alojamiento teatro tívoli km aeropuerto aeropuerto barcelona prat 11 km
Palau de la música 13,1526,6.7,"Palau de la música 13 está en el centro de Barcelona, a 1,9 km de Platja de la Barceloneta y a 1,9 km de Platja del Somorrostro, y ofrece wifi gratis. Este apartamento está a 2 km de Platja de Sant Miquel y a 9 min a pie de Teatro Tívoli.

El apartamento de 1 dormitorio dispone de sala de estar con TV de pantalla plana, cocina totalmente equipada y 1 baño.

Cerca del alojamiento hay puntos de interés como Catedral de Barcelona, Palacio de la Música Catalana y Paseo de Gracia. El aeropuerto (Aeropuerto de Barcelona - El Prat) está a 13 km.",palau música 13 centro barcelona km platja barceloneta km platja somorrostro ofrec wifi grati apartamento 2 km platja sant miquel 9 min pie teatro tívoli apartamento 1 dormitorio dispon sala tv pantalla plana cocina totalment equipada 1 baño cerca alojamiento punto interé catedr barcelona palacio música catalana paseo gracia aeropuerto aeropuerto barcelona prat 13 km
Stylish typical BCN flat,2256,8.4,"Stylish typical BCN flat está en el barrio de Sants-Montjuïc, en Barcelona, a 14 min a pie de Fuente Mágica de Montjuïc y a 2,9 km de Plaza Cataluña, y ofrece alojamiento equipado con balcón y wifi gratis. Este apartamento está a 3,1 km de Paseo de Gracia y a 3,4 km de Palacio de la Música Catalana.

Este apartamento de 2 dormitorios tiene aire acondicionado y ofrece 1 baño con ducha y secador de pelo. La cocina está equipada con microondas y tostadora, además de cafetera.

Cerca del alojamiento hay puntos de interés como Portal del Ángel, Palau Sant Jordi y Mercado de la Boquería. El aeropuerto (Aeropuerto de Barcelona - El Prat) está a 12 km.",stylish typic bcn flat barrio barcelona 14 min pie fuent mágica montjuïc km plaza cataluña ofrec alojamiento equipado balcón wifi grati apartamento km paseo gracia km palacio música catalana apartamento 2 dormitorio air acondicionado ofrec 1 baño ducha secador pelo cocina equipada microonda tostadora ademá cafetera cerca alojamiento punto interé portal ángel palau sant jordi mercado boquería aeropuerto aeropuerto barcelona prat 12 km
