Name,Price,Score,Description,Cleaned_Description
Hotel Casa Teva Barcelona,1958,8.8,"Situado en el animado barrio del Raval, a 250 metros de Las Ramblas, el Hotel Casa Teva Barcelona ofrece fácil acceso al casco antiguo de Barcelona. Cuenta con recepción abierta las 24 horas y habitaciones con aire acondicionado y televisor.

El Palau Güell de Gaudí está a sólo 100 metros del hotel, mientras que el mercado de la Boquería se encuentra a 5 minutos a pie.

En las inmediaciones hay varios restaurantes, bares y cafeterías. El puerto viejo de Barcelona y el centro comercial Maremagnum están a 20 minutos a pie del hotel.

La estación de metro Drassanes se halla a unos 500 metros de distancia. Los huéspedes pueden llegar a lugares de interés como la Sagrada Familia y el Parc Güell en unos 20 minutos en metro.",situado animado barrio raval 250 metro rambla hotel casa teva barcelona ofrec fácil acceso casco antiguo barcelona cuenta recepción abierta 24 hora habitacion air acondicionado televisor palau güell gaudí sólo 100 metro hotel mientra mercado boquería encuentra 5 minuto pie inmediacion vario restaurant bare cafetería puerto viejo barcelona centro comerci maremagnum 20 minuto pie hotel estación metro drassan halla 500 metro distancia huésped pueden llegar lugar interé sagrada familia parc güell 20 minuto metro
Chi,1757,8.9,"El Chi Hotel está situado en el barrio barcelonés del Eixample, junto a la estación de metro de Rocafort y a 15 minutos a pie de la plaza Catalunya, y ofrece habitaciones con aire acondicionado y calefacción (según la temporada) y WiFi gratuita.

Las habitaciones son modernas y cuentan con TV de pantalla plana, minibar, caja fuerte y baño privado con secador de pelo y artículos de aseo gratuitos.

La recepción está abierta las 24 horas. El personal puede facilitar información turística y el servicio de alquiler de coches.

En los alrededores hay numerosas tiendas, restaurantes y bares.",chi hotel situado barrio barceloné eixampl junto estación metro rocafort 15 minuto pie plaza catalunya ofrec habitacion air acondicionado calefacción según temporada wifi gratuita habitacion moderna cuentan tv pantalla plana minibar caja fuert baño privado secador pelo artículo aseo gratuito recepción abierta 24 hora person pued facilitar información turística servicio alquil coch alrededor numerosa tienda restaurant bare
Exe Plaza Catalunya,2588,8.4,"Exe Plaza Catalunya es un alojamiento con una buena ubicación en Barcelona que ofrece terraza, wifi gratis y habitaciones con aire acondicionado. Este hotel de 4 estrellas ofrece servicio de conserjería y mostrador de información turística. Este alojamiento libre de humo se encuentra a 2,7 km de Platja de Sant Miquel.

En el hotel, todas las habitaciones cuentan con escritorio. Todas las unidades incluyen caja fuerte.

En Exe Plaza Catalunya se puede disfrutar de un desayuno buffet o sin gluten.

En la recepción 24 horas se habla catalán, inglés, español y francés, y el personal está siempre dispuesto a echar una mano.

Cerca del alojamiento hay puntos de interés como Plaza Cataluña, Portal del Ángel y Mercado de la Boquería. El aeropuerto (Aeropuerto de Barcelona - El Prat) está a 12 km.",exe plaza catalunya alojamiento buena ubicación barcelona ofrec terraza wifi grati habitacion air acondicionado hotel 4 estrella ofrec servicio conserjería mostrador información turística alojamiento libr humo encuentra km platja sant miquel hotel toda habitacion cuentan escritorio toda unidad incluyen caja fuert exe plaza catalunya pued disfrutar desayuno buffet gluten recepción 24 hora habla catalán inglé español francé person siempr dispuesto echar mano cerca alojamiento punto interé plaza cataluña portal ángel mercado boquería aeropuerto aeropuerto barcelona prat 12 km
Hotel Nouvel,1707,8.0,"El Hotel Nouvel ofrece habitaciones con aire acondicionado, WiFi gratuita y un restaurante, y se encuentra en una calle peatonal, a solo 100 metros de la plaza de Cataluña de Barcelona y Las Ramblas.

Este hotel está ubicado en un edificio del siglo XIX y está decorado con techos ornamentados, lámparas de cristal y bronce fundido, y suelos de mármol.

Las habitaciones están equipadas con TV de pantalla plana, ventanas de doble acristalamiento y baño privado con bañera o ducha y secador de pelo. Se ofrece servicio de alquiler de caja fuerte.

El restaurante del hotel, La Lluna, sirve platos de cocina mediterránea. También hay máquinas expendedoras de aperitivos, hielo y bebidas.

En la recepción, abierta las 24 horas, hay servicios de alquiler de coches, lavandería y venta de entradas. Se ofrece consigna de equipaje y una sala de lectura con 2 ordenadores.

El Hotel Nouvel se encuentra a solo 2 minutos a pie de la calle comercial Portal del Ángel y a 10 minutos a pie de la catedral de Barcelona y el barrio Gótico.",hotel nouvel ofrec habitacion air acondicionado wifi gratuita restaurant encuentra call peaton solo 100 metro plaza cataluña barcelona rambla hotel ubicado edificio siglo xix decorado techo ornamentado lámpara cristal bronc fundido suelo mármol habitacion equipada tv pantalla plana ventana dobl acristalamiento baño privado bañera ducha secador pelo ofrec servicio alquil caja fuert restaurant hotel lluna sirv plato cocina mediterránea máquina expendedora aperitivo hielo bebida recepción abierta 24 hora servicio alquil coch lavandería venta entrada ofrec consigna equipaj sala lectura 2 ordenador hotel nouvel encuentra solo 2 minuto pie call comerci portal ángel 10 minuto pie catedr barcelona barrio gótico
Caledonian,1880,8.6,"El Caledonian goza de una ubicación ideal en la Gran Vía de Barcelona, a solo 5 minutos a pie de la plaza de Cataluña y de Las Ramblas. Ofrece habitaciones con WiFi gratuita.

Las habitaciones del Caledonian presentan una decoración sencilla y atractiva con suelo de madera y disponen de aire acondicionado. Todas tienen minibar y algunas ofrecen vistas a la Gran Vía.

Este alojamiento sirve un desayuno buffet todos los días en el comedor. A 10 minutos a pie del Caledonian se encuentran varios restaurantes.

La estación de metro Universitat está a solo 100 metros del alojamiento y conecta con lugares de interés como La Pedrera de Gaudí y la Sagrada Familia en 15 minutos.

Hay recepción 24 horas y servicio de registro de entrada y salida exprés. El alojamiento también ofrece consigna de equipaje.",caledonian goza ubicación ideal gran vía barcelona solo 5 minuto pie plaza cataluña rambla ofrec habitacion wifi gratuita habitacion caledonian presentan decoración sencilla atractiva suelo madera disponen air acondicionado toda minibar ofrecen vista gran vía alojamiento sirv desayuno buffet día comedor 10 minuto pie caledonian encuentran vario restaurant estación metro universitat solo 100 metro alojamiento conecta lugar interé pedrera gaudí sagrada familia 15 minuto recepción 24 hora servicio registro entrada salida expré alojamiento ofrec consigna equipaj
Dalia Ramblas,1429,8.0,"El Dalia Ramblas, que ofrece habitaciones con aire acondicionado y WiFi gratuita, está situado en el barrio del Raval, a 50 metros de La Rambla. Cuenta con buenas conexiones de transporte público, recepción abierta las 24 horas y consigna de equipaje.

Las habitaciones presentan una decoración moderna y funcional. Todas ellas incluyen TV de pantalla plana, armario, escritorio y baño privado con bañera o ducha, secador de pelo y artículos de aseo gratuitos.

El Dalia Ramblas se encuentra en el centro animado de la ciudad, cerca de numerosos bares y restaurantes.

El Dalia Ramblas está al lado del barrio gótico y a 10 minutos a pie de la Plaza Catalunya y la catedral de Barcelona. La plaza Reial queda a 5 minutos a pie.

Este hotel se encuentra a 12 km del aeropuerto de Barcelona. Los autobuses con destino al aeropuerto paran de forma regular a solo 800 metros.",dalia rambla ofrec habitacion air acondicionado wifi gratuita situado barrio raval 50 metro rambla cuenta buena conexion transport público recepción abierta 24 hora consigna equipaj habitacion presentan decoración moderna funcion toda incluyen tv pantalla plana armario escritorio baño privado bañera ducha secador pelo artículo aseo gratuito dalia rambla encuentra centro animado ciudad cerca numeroso bare restaurant dalia rambla lado barrio gótico 10 minuto pie plaza catalunya catedr barcelona plaza reial queda 5 minuto pie hotel encuentra 12 km aeropuerto barcelona autobus destino aeropuerto paran forma regular solo 800 metro
Mihlton Barcelona Boutique B&B,1611,8.7,"Mihlton Barcelona Boutique B&B está en el centro de Barcelona, a 4 min a pie de Paseo de Gracia y a 400 metros de La Pedrera. Ofrece alojamiento con wifi gratis, aire acondicionado y acceso a un jardín con terraza.

El bed and breakfast ofrece TV de pantalla plana y baño privado con artículos de aseo gratuitos, secador de pelo y ducha. Algunas unidades disponen de zona de estar y/o balcón.

El desayuno diario ofrece opciones buffet, continentales o inglesas/irlandesas.

Cerca del alojamiento hay puntos de interés como Casa Batlló, Estación de metro Passeig de Gràcia y Teatro Tívoli. El aeropuerto (Aeropuerto de Barcelona - El Prat) está a 13 km.",mihlton barcelona boutiqu b b centro barcelona 4 min pie paseo gracia 400 metro pedrera ofrec alojamiento wifi grati air acondicionado acceso jardín terraza bed and breakfast ofrec tv pantalla plana baño privado artículo aseo gratuito secador pelo ducha unidad disponen zona balcón desayuno diario ofrec opcion buffet continental cerca alojamiento punto interé casa batlló estación metro passeig gràcia teatro tívoli aeropuerto aeropuerto barcelona prat 13 km
Catalonia Roma,2117,8.4,"El Catalonia Roma se encuentra a 600 metros de la estación de Sants (AVE y metro). Ofrece WiFi gratuita. El centro de Barcelona queda a 10 minutos en metro o autobús.

Desde la estación de Sants, se puede tomar un tren directo al aeropuerto de Barcelona. La parada del autobús que lleva al aeropuerto también está fuera.

Las habitaciones son modernas y disponen de aire acondicionado, suelo de madera, TV vía satélite y nevera pequeña con agua gratuita. Hay caja fuerte, minibar y baño privado con secador de pelo.

El restaurante del hotel sirve un desayuno buffet. Se presta un servicio de habitaciones. También alberga un bar.

El hotel se encuentra a unos 15 minutos a pie de la plaza de España, de la Fuente Mágica de Montjuic y del Centro de Conferencias Fira.

La recepción del Catalonia Roma está abierta las 24 horas y cuenta con un gran tragaluz de estilo vidriera. Hay servicio de alquiler de coches y servicio de cambio de divisa.

Mascotas: Solo se admite 1 perro o gato de menos de 20 kg por habitación (bajo petición). Se debe abonar un suplemento de 22 EUR por animal y noche, además de un depósito de 200 EUR.",catalonia roma encuentra 600 metro estación sant ave metro ofrec wifi gratuita centro barcelona queda 10 minuto metro autobú estación sant pued tomar tren directo aeropuerto barcelona parada autobú lleva aeropuerto habitacion moderna disponen air acondicionado suelo madera tv vía satélit nevera pequeña agua gratuita caja fuert minibar baño privado secador pelo restaurant hotel sirv desayuno buffet presta servicio habitacion alberga bar hotel encuentra 15 minuto pie plaza españa fuent mágica montjuic centro conferencia fira recepción catalonia roma abierta 24 hora cuenta gran tragaluz estilo vidriera servicio alquil coch servicio cambio divisa mascota solo admit 1 perro gato meno 20 kg habitación bajo petición debe abonar suplemento 22 eur anim noch ademá depósito 200 eur
Flor Parks,1379,8.5,"El Flor Parks, que ofrece terraza en la azotea y wifi gratuita, se encuentra en Las Ramblas de Barcelona, junto a la estación de metro Liceu. Se halla a 200 metros del mercado de La Boquería y ofrece habitaciones insonorizadas.

Las habitaciones del Flor Parks tienen aire acondicionado, balcón, TV vía satélite y minibar. Los baños privados tienen secador de pelo y algunos incluyen bañera de hidromasaje.

El restaurante del Hotel Flor ofrece un menú cerrado y platos a la carta. También hay un bar cafetería y una cafetería.

El hotel goza de una ubicación céntrica, ideal para explorar el Barrio Gótico y la catedral de Barcelona, que se encuentra a solo 10 minutos a pie. El puerto y el centro comercial Maremagnum están a menos de 1 km del Flor Parks.",flor park ofrec terraza azotea wifi gratuita encuentra rambla barcelona junto estación metro liceu halla 200 metro mercado boquería ofrec habitacion insonorizada habitacion flor park air acondicionado balcón tv vía satélit minibar baño privado secador pelo incluyen bañera hidromasaj restaurant hotel flor ofrec menú cerrado plato carta bar cafetería cafetería hotel goza ubicación céntrica ideal explorar barrio gótico catedr barcelona encuentra solo 10 minuto pie puerto centro comerci maremagnum meno 1 km flor park
Barcelona City North Hostal,1274,7.2,"El Barcelona City North Hostal ofrece alojamiento con buena relación calidad precio y conexión Wi-Fi gratuita. Se encuentra en la tranquila zona de Sarrià-Sant Gervasi de Barcelona y está bien comunicado en coche con el aeropuerto.

Las habitaciones del Barcelona City North son limpias y disponen de calefacción y aire acondicionado. Todas tienen baño privado, TV y hervidor de agua.

El Barcelona City North Hostal cuenta con una zona común con microondas y nevera.

El albergue se encuentra a poca distancia a pie del popular barrio de Gràcia y de los edificios modernistas del Eixample.

La cercana estación de metro de Lesseps ofrece fácil acceso a Vallcarca y al Parc Güell. La plaza Catalunya está a solo 3 paradas.",barcelona citi north hostal ofrec alojamiento buena relación calidad precio conexión gratuita encuentra tranquila zona gervasi barcelona bien comunicado coch aeropuerto habitacion barcelona citi north limpia disponen calefacción air acondicionado toda baño privado tv hervidor agua barcelona citi north hostal cuenta zona común microonda nevera albergu encuentra poca distancia pie popular barrio gràcia edificio modernista eixampl cercana estación metro lessep ofrec fácil acceso vallcarca parc güell plaza catalunya solo 3 parada
Inside Barcelona Apartments Princep,2056,8.7,"El Inside Barcelona Apartments Princep ofrece alojamiento moderno con una buena relación calidad precio. Los apartamentos están situados en una calle tranquila, cerca de la plaza de España.

Los apartamentos están bien equipados y disponen de cocina completa y aire acondicionado. Hay wifi gratuita, Smart TV, lavadora, lavavajillas y cafetera Nespresso. El edificio se reformó por completo en septiembre de 2021.

Los alojamientos son amplios y tienen cocina, baño y zona de salón comedor. Los huéspedes podrán relajarse y preparar sus propias comidas.

Los apartamentos están situados en una zona bien comunicada de la ciudad, la plaza de España y el recinto ferial Fira están a entre 2 y 10 minutos a pie. La montaña de Montjuïc, situada un poco más lejos, alberga el Museo Nacional de Arte de Cataluña y la Fundación Miró.

Nuestros clientes dicen que esta parte de Barcelona es su favorita, según los comentarios independientes.

El Inside Barcelona Apartments Princep ha recibido clientes de Booking.com desde el 14 de octubre de 2008.",insid barcelona apart princep ofrec alojamiento moderno buena relación calidad precio apartamento situado call tranquila cerca plaza españa apartamento bien equipado disponen cocina completa air acondicionado wifi gratuita smart tv lavadora lavavajilla cafetera nespresso edificio reformó completo septiembr alojamiento amplio cocina baño zona salón comedor huésped podrán relajars preparar propia comida apartamento situado zona bien comunicada ciudad plaza españa recinto ferial fira 2 10 minuto pie montaña montjuïc situada lejo alberga museo nacion art cataluña fundación miró client dicen part barcelona favorita según comentario independient insid barcelona apart princep recibido client 14 octubr 2008
The Social Hub Barcelona Poblenou,1941,8.8,"The Social Hub Barcelona Poblenou está en Barcelona, a 16 min a pie de Platja de Llevant, y dispone de alojamiento con piscina al aire libre, parking privado, centro de fitness y jardín. Este alojamiento ofrece salón de uso común y centro de negocios, además de wifi gratis en todo el alojamiento. El hotel tiene terraza, vistas a la ciudad, restaurante y bar.

El hotel ofrece habitaciones con aire acondicionado, escritorio, cafetera, nevera, caja fuerte, TV de pantalla plana y baño privado con ducha. Las habitaciones disponen de hervidor, y algunas también ofrecen zona de cocina con minibar. En The Social Hub Barcelona Poblenou, cada habitación dispone de ropa de cama y toallas.

En el alojamiento se puede disfrutar de un desayuno buffet o continental.

Se puede jugar al ping-pong en The Social Hub Barcelona Poblenou, y también hay alquiler de bicicletas.

En recepción se habla catalán, checo, inglés y español, y el personal estará encantado de ayudar en cualquier momento.

Platja de la Nova Mar Bella está a 19 min a pie del alojamiento, y Playa de la Mar Bella está a 1,7 km. El aeropuerto (Aeropuerto de Barcelona - El Prat) está a 17 km.",the social hub barcelona poblen barcelona 16 min pie platja llevant dispon alojamiento piscina air libr park privado centro fit jardín alojamiento ofrec salón uso común centro negocio ademá wifi grati alojamiento hotel terraza vista ciudad restaurant bar hotel ofrec habitacion air acondicionado escritorio cafetera nevera caja fuert tv pantalla plana baño privado ducha habitacion disponen hervidor ofrecen zona cocina minibar the social hub barcelona poblen cada habitación dispon ropa cama toalla alojamiento pued disfrutar desayuno buffet continent pued jugar the social hub barcelona poblen alquil bicicleta recepción habla catalán checo inglé español person encantado ayudar cualquier momento platja nova mar bella 19 min pie alojamiento playa mar bella km aeropuerto aeropuerto barcelona prat 17 km
Pestana Arena Barcelona,2034,8.5,"El Pestana Arena Barcelona está situado a menos de 5 minutos a pie de la Plaza de España y del centro de exposiciones Fira. Ofrece gimnasio, sauna y habitaciones modernas con aire acondicionado y conexión gratuita a internet por cable.

Algunas habitaciones ofrecen uso gratuito de la sala de reuniones Maritimo, para reuniones privadas y con capacidad para hasta 12 personas.

El Pestana Arena Barcelona está a solo 3 minutos a pie del centro comercial Las Arenas y a 8 minutos a pie de la estación de Sants. Además, se puede llegar en metro desde la Plaza de España hasta las Ramblas en 5 minutos.

Las habitaciones cuentan con suelo de parquet y decoración elegante. Cada una tiene escritorio, carta de almohadas y TV LCD con canales vía satélite.

El restaurante del hotel sirve comida mediterránea y tiene terraza. También hay un bar que prepara aperitivos y bebidas. El desayuno del hotel incluye productos para personas celíacas.

Hasta nuevo aviso, el uso del jacuzzi está prohibido debido a la sequía existente en Cataluña.",pestana arena barcelona situado meno 5 minuto pie plaza españa centro exposicion fira ofrec gimnasio sauna habitacion moderna air acondicionado conexión gratuita internet cabl habitacion ofrecen uso gratuito sala reunion maritimo reunion privada capacidad 12 persona pestana arena barcelona solo 3 minuto pie centro comerci arena 8 minuto pie estación sant ademá pued llegar metro plaza españa rambla 5 minuto habitacion cuentan suelo parquet decoración elegant cada escritorio carta almohada tv lcd canal vía satélit restaurant hotel sirv comida mediterránea terraza bar prepara aperitivo bebida desayuno hotel incluy producto persona celíaca nuevo aviso uso jacuzzi prohibido debido sequía existent cataluña
Super Balmes Guest House,1199,8.4,"El Super Balmes Guest House se encuentra en el centro de Barcelona, a 2 minutos a pie de la plaza Cataluña. Hay WiFi gratuita.

The Guest House ofrece habitaciones privadas en apartamentos compartidos ubicados en diferentes edificios de la misma zona céntrica.

Todos los alojamientos tienen TV de pantalla plana y baño privado o compartido. Se proporciona ropa de cama y toallas. Todos los apartamentos tienen una cocina totalmente equipada y un salón compartido con sofás.

A poca distancia a pie hay muchos bares y restaurantes. A 10 minutos a pie hay una parada de los autobuses que ofrecen conexiones frecuentes con el aeropuerto.

Las imágenes de la parte superior de esta página corresponden a una selección de diferentes habitaciones y apartamentos situados en la zona Centro de Barcelona. Seleccione una fecha y haga clic en la habitación que desea para ver fotos de cada apartamento.",super balm guest hous encuentra centro barcelona 2 minuto pie plaza cataluña wifi gratuita the guest hous ofrec habitacion privada apartamento compartido ubicado diferent edificio misma zona céntrica alojamiento tv pantalla plana baño privado compartido proporciona ropa cama toalla apartamento cocina totalment equipada salón compartido sofá poca distancia pie bare restaurant 10 minuto pie parada autobus ofrecen conexion frecuent aeropuerto imágen part superior página corresponden selección diferent habitacion apartamento situado zona centro barcelona seleccion fecha haga clic habitación desea ver foto cada apartamento
Àmfores Boutique Guest House,1538,8.2,"Set within 1.2 km of Santa Maria del Mar and 1.1 km of Picasso Museum, Àmfores Boutique Guest House provides rooms in Barcelona. Located around 850 m from Tivoli Theatre, the guest house with free WiFi is also 750 m away from La Seu, Cathedral of Barcelona. The property is situated in the Ciutat Vella district.

All guest rooms in the guest house are equipped with a flat-screen TV. Each room comes with a private bathroom with a shower and free toiletries.

Àmfores Boutique Guest House is set in a building of medieval origin, located next to the Palau de la Música and the city centre.

The accommodation offers a terrace.

Speaking Catalan and English, staff are ready to help at the reception.

Plaça Catalunya is 800 m from Àmfores Boutique Guest House. The nearest airport is Barcelona El Prat Airport, 18 km from the guest house.

The accommodation offers a terrace with a small swimming pool (from may till october).",set within km of santa maria mar and km of picasso museum àmfore boutiqu guest hous provid room in barcelona locat around 850 m from tivoli theatr the guest hous with free wifi is also 750 m away from seu cathedr of barcelona the properti is situat in the ciutat vella district all guest room in the guest hous are equip with tv each room come with privat bathroom with shower and free toiletri àmfore boutiqu guest hous is set in build of mediev origin locat next to the palau música and the citi centr the accommod offer terrac speak catalan and english staff are readi to help at the recept plaça catalunya is 800 m from àmfore boutiqu guest hous the nearest airport is barcelona prat airport 18 km from the guest hous the accommod offer terrac with small swim pool from may till octob
Acevi Villarroel,1812,8.0,"El Acevi Villarroel ofrece wifi gratuita de alta velocidad, spa y piscina en la azotea durante el verano. Se halla a 400 metros de la estación de metro Urgell y a 15 minutos a pie de la plaza Cataluña de Barcelona.

Las habitaciones del Acevi presentan una decoración elegante y suelo de parquet. Todas tienen TV vía satélite.

El spa del Hotel Acevi Villarroel está disponible de forma gratuita. Incluye baño de vapor, sauna, hammam y gimnasio. Se ofrece servicio de masajes a petición. También hay terraza solárium con tumbonas.

El Acevi Villarroel se encuentra a 10 minutos a pie de la Universidad de Barcelona y del animado barrio del Raval. La estación de metro Hospital Clinic se halla a 600 metros y ofrece conexiones directas con la Sagrada Familia y el estadio del FC Barcelona, el Camp Nou.",acevi villarroel ofrec wifi gratuita alta velocidad spa piscina azotea verano halla 400 metro estación metro urgel 15 minuto pie plaza cataluña barcelona habitacion acevi presentan decoración elegant suelo parquet toda tv vía satélit spa hotel acevi villarroel dispon forma gratuita incluy baño vapor sauna hammam gimnasio ofrec servicio masaj petición terraza solárium tumbona acevi villarroel encuentra 10 minuto pie universidad barcelona animado barrio raval estación metro hospit clinic halla 600 metro ofrec conexion directa sagrada familia estadio fc barcelona camp nou
