Name,Price,Rating,Detail Link,stars,center,num_coments,Description
Far Home Gran Vía,€ 1.380,"Puntuación: 8,28,2",https://www.booking.com/hotel/es/far-home-hostel.es.html?label=gen173nr-1FCAEoggI46AdIClgEaEaIAQGYAQq4AQfIAQ_YAQHoAQH4AQKIAgGoAgO4ArnZiL0GwAIB0gIkMTNlMDQ2YjEtMmY1OC00MmQzLThkNmEtNTdjMjJmMzM4MWEw2AIF4AIB&aid=304142&ucfs=1&arphpl=1&checkin=2025-03-01&checkout=2025-03-07&dest_id=176&dest_type=district&group_adults=2&req_adults=2&no_rooms=1&group_children=0&req_children=0&hpos=18&hapos=319&sr_order=popularity&srpvid=46716a22cf15007f&srepoch=1738681570&all_sr_blocks=43807727_91928782_0_0_0&highlighted_blocks=43807727_91928782_0_0_0&matching_block_id=43807727_91928782_0_0_0&sr_pri_blocks=43807727_91928782_0_0_0__137959&from=searchresults,NA,NA,2.188,"El moderno Far Home Gran Vía ofrece habitaciones privadas y compartidas con camas y taquillas, ambas individuales. Está situado en pleno centro de Madrid, a solo 350 metros de la Puerta del Sol.

Las habitaciones son amplias y disponen de aire acondicionado y camas con colchones de espuma viscoelástica. Algunas habitaciones tienen baño privado y TV de pantalla plana. Se proporcionan toallas, ropa de cama y servicio de lavandería.

El Far Home Gran Vía ofrece zona de estar con TV, ordenador con conexión a internet y WiFi gratuita en todas las instalaciones.

El establecimiento se encuentra a unos 10 minutos a pie de la Plaza Mayor y del Palacio Real y a menos de 20 minutos a pie del parque del Retiro y del Museo del Prado."
Fabuloso Atico Doble Altura para 3pax en Chueca,€ 736,"Puntuación: 5,65,6",https://www.booking.com/hotel/es/fabuloso-atico-doble-altura-para-3pax-en-chueca.es.html?label=gen173nr-1FCAEoggI46AdIClgEaEaIAQGYAQq4AQfIAQ_YAQHoAQH4AQKIAgGoAgO4ArnZiL0GwAIB0gIkMTNlMDQ2YjEtMmY1OC00MmQzLThkNmEtNTdjMjJmMzM4MWEw2AIF4AIB&aid=304142&ucfs=1&arphpl=1&checkin=2025-03-01&checkout=2025-03-07&dest_id=176&dest_type=district&group_adults=2&req_adults=2&no_rooms=1&group_children=0&req_children=0&hpos=19&hapos=320&sr_order=popularity&srpvid=46716a22cf15007f&srepoch=1738681570&all_sr_blocks=1136268902_386256420_3_0_0&highlighted_blocks=1136268902_386256420_3_0_0&matching_block_id=1136268902_386256420_3_0_0&sr_pri_blocks=1136268902_386256420_3_0_0__73646&from=searchresults,NA,NA,25,"Fabuloso Atico Doble Altura para 3pax en Chueca ofrece alojamiento muy bien ubicado en el centro de Madrid y tiene terraza. El alojamiento está a 8 min a pie de Estación de metro Gran Vía y dispone de wifi gratis en todo el alojamiento.

Este apartamento con aire acondicionado consta de 1 dormitorio, una sala de estar, una cocina totalmente equipada con nevera y cafetera, y 1 baño con ducha y secador de pelo. Hay toallas y ropa de cama en el apartamento.

Cerca del alojamiento hay puntos de interés como Museo Thyssen-Bornemisza, Gran Vía y Parque de El Retiro. El aeropuerto (Aeropuerto Adolfo Suárez Madrid - Barajas) está a 12 km."
Petit Palace Alcalá,€ 1.592,"Puntuación: 8,38,3",https://www.booking.com/hotel/es/petitpalacealcalatorre.es.html?label=gen173nr-1FCAEoggI46AdIClgEaEaIAQGYAQq4AQfIAQ_YAQHoAQH4AQKIAgGoAgO4ArnZiL0GwAIB0gIkMTNlMDQ2YjEtMmY1OC00MmQzLThkNmEtNTdjMjJmMzM4MWEw2AIF4AIB&aid=304142&ucfs=1&arphpl=1&checkin=2025-03-01&checkout=2025-03-07&dest_id=176&dest_type=district&group_adults=2&req_adults=2&no_rooms=1&group_children=0&req_children=0&hpos=20&hapos=321&sr_order=popularity&srpvid=46716a22cf15007f&srepoch=1738681570&all_sr_blocks=9185901_88191969_0_1_0_182163&highlighted_blocks=9185901_88191969_0_1_0_182163&matching_block_id=9185901_88191969_0_1_0_182163&sr_pri_blocks=9185901_88191969_0_1_0_182163_159210&from=searchresults,4,NA,2.896,"El Petit Palace Alcala está ubicado en un rascacielos de la década de 1930, uno de los edificios más emblemáticos de Madrid, a solo 250 metros de la Puerta del Sol.

Las habitaciones están equipadas con minibar, aire acondicionado, TV de pantalla plana, WiFi gratuita y baño privado. La recepción ofrece un préstamo de bicicletas (sujetas a disponibilidad).

Este hotel sirve un desayuno buffet. Se ofrecen bebidas calientes gratuitas en la recepción del hotel.

El personal de la recepción 24 horas puede facilitar información sobre lugares de interés y actividades para disfrutar en Madrid. El casino de Madrid se encuentra a solo 100 metros, y el Círculo de Bellas Artes de Madrid, un centro multidisciplinar con uno de los programas culturales más dinámicos del mundo, está a solo 3 minutos a pie.

Los museos El Prado, Reina Sofía y Thyssen quedan a unos 15 minutos a pie. La estación de metro Sevilla está justo al lado del hotel, mientras que la estación de tren de Atocha queda a 15 minutos a pie."
Apartamentos Day Madrid TRIBUNAL Centro Gran Via Sol,€ 708,"Puntuación: 6,06,0",https://www.booking.com/hotel/es/apartamentos-turisticos-malasana-centro-de-madrid.es.html?label=gen173nr-1FCAEoggI46AdIClgEaEaIAQGYAQq4AQfIAQ_YAQHoAQH4AQKIAgGoAgO4ArnZiL0GwAIB0gIkMTNlMDQ2YjEtMmY1OC00MmQzLThkNmEtNTdjMjJmMzM4MWEw2AIF4AIB&aid=304142&ucfs=1&arphpl=1&checkin=2025-03-01&checkout=2025-03-07&dest_id=176&dest_type=district&group_adults=2&req_adults=2&no_rooms=1&group_children=0&req_children=0&hpos=21&hapos=322&sr_order=popularity&srpvid=46716a22cf15007f&srepoch=1738681570&all_sr_blocks=750402701_402762840_2_0_0&highlighted_blocks=750402701_402762840_2_0_0&matching_block_id=750402701_402762840_2_0_0&sr_pri_blocks=750402701_402762840_2_0_0__70782&from=searchresults,3,NA,18,"Apartamentos Day Madrid TRIBUNAL Centro Gran Via Sol ofrece alojamiento con wifi gratis, cocina, nevera, horno y microondas a 700 metros del centro de Madrid.

Cada unidad dispone de baño privado, ducha, aire acondicionado, TV y tostadora.

Cerca del alojamiento hay puntos de interés como Estación de metro Gran Vía, Gran Vía y Estación de metro Plaza de España. El aeropuerto (Aeropuerto Adolfo Suárez Madrid - Barajas) está a 18 km."
Hotel Miau,€ 1.474,"Puntuación: 8,68,6",https://www.booking.com/hotel/es/miau.es.html?label=gen173nr-1FCAEoggI46AdIClgEaEaIAQGYAQq4AQfIAQ_YAQHoAQH4AQKIAgGoAgO4ArnZiL0GwAIB0gIkMTNlMDQ2YjEtMmY1OC00MmQzLThkNmEtNTdjMjJmMzM4MWEw2AIF4AIB&aid=304142&ucfs=1&arphpl=1&checkin=2025-03-01&checkout=2025-03-07&dest_id=176&dest_type=district&group_adults=2&req_adults=2&no_rooms=1&group_children=0&req_children=0&hpos=22&hapos=323&sr_order=popularity&srpvid=46716a22cf15007f&srepoch=1738681570&all_sr_blocks=1226001_333379906_0_2_0&highlighted_blocks=1226001_333379906_0_2_0&matching_block_id=1226001_333379906_0_2_0&sr_pri_blocks=1226001_333379906_0_2_0__147397&from=searchresults,3,NA,2.529,"El Hotel Miau, un establecimiento pequeño con encanto, está ubicado en un edificio del siglo XIX de la famosa plaza de Santa Ana. Hay conexión WiFi gratuita en todas las habitaciones.

Las habitaciones del Hotel Miau son cómodas y presentan una decoración sencilla de estilo contemporáneo. Algunas gozan de vistas a la plaza de Santa Ana.

La plaza de Santa Ana, una de las más animadas de Madrid, alberga una gran variedad de bares y restaurantes. El establecimiento está ubicado junto al teatro Español y cerca de muchos de los principales lugares de interés turístico, como la Puerta del Sol, Plaza Mayor, el Museo del Prado o el Museo Thyssen-Bornemisza. Hay aparcamiento disponible por un precio reducido cerca del establecimiento."
"Reencuentro en Madrid para 2, vive Mira el Río Alta 10 E3",€ 913,"Puntuación: 7,67,6",https://www.booking.com/hotel/es/cool-loft-para-2pax-en-la-latina-centro-de-madrid.es.html?label=gen173nr-1FCAEoggI46AdIClgEaEaIAQGYAQq4AQfIAQ_YAQHoAQH4AQKIAgGoAgO4ArnZiL0GwAIB0gIkMTNlMDQ2YjEtMmY1OC00MmQzLThkNmEtNTdjMjJmMzM4MWEw2AIF4AIB&aid=304142&ucfs=1&arphpl=1&checkin=2025-03-01&checkout=2025-03-07&dest_id=176&dest_type=district&group_adults=2&req_adults=2&no_rooms=1&group_children=0&req_children=0&hpos=23&hapos=324&sr_order=popularity&srpvid=46716a22cf15007f&srepoch=1738681570&all_sr_blocks=1309635701_403743888_2_0_0&highlighted_blocks=1309635701_403743888_2_0_0&matching_block_id=1309635701_403743888_2_0_0&sr_pri_blocks=1309635701_403743888_2_0_0__91279&from=searchresults,3,NA,5,"Reencuentro en Madrid para 2, vive Mira el Río Alta 10 E3 se encuentra en el corazón de Madrid, a poca distancia de Puerta de Toledo y Mercado de San Miguel. Ofrece equipamiento como wifi gratis, aire acondicionado, fogones y cafetera. Este apartamento está a 1,9 km de Estación de tren de Atocha y a 19 min a pie de Museo Reina Sofía.

Este apartamento tiene 1 dormitorio, cocina con nevera y microondas, TV de pantalla plana, zona de estar y 1 baño con ducha.

Cerca del alojamiento hay puntos de interés como Plaza Mayor de Madrid, Puerta del Sol y Royal Palace of Madrid. El aeropuerto (Aeropuerto Adolfo Suárez Madrid - Barajas) está a 15 km."
Apartamentos Mayor Centro,€ 1.048,"Puntuación: 9,09,0",https://www.booking.com/hotel/es/apartamentos-mayor-centro.es.html?label=gen173nr-1FCAEoggI46AdIClgEaEaIAQGYAQq4AQfIAQ_YAQHoAQH4AQKIAgGoAgO4ArnZiL0GwAIB0gIkMTNlMDQ2YjEtMmY1OC00MmQzLThkNmEtNTdjMjJmMzM4MWEw2AIF4AIB&aid=304142&ucfs=1&arphpl=1&checkin=2025-03-01&checkout=2025-03-07&dest_id=176&dest_type=district&group_adults=2&req_adults=2&no_rooms=1&group_children=0&req_children=0&hpos=24&hapos=325&sr_order=popularity&srpvid=46716a22cf15007f&srepoch=1738681570&all_sr_blocks=1905816_122010391_2_0_0&highlighted_blocks=1905816_122010391_2_0_0&matching_block_id=1905816_122010391_2_0_0&sr_pri_blocks=1905816_122010391_2_0_0__104794&from=searchresults,3,NA,2.795,"Apartamentos recientemente reformados. Presentan un encantador estilo rústico y ofrecen una fantástica ubicación en el corazón cultural de Madrid.

Se encuentran entre la Puerta del Sol y la Plaza Mayor, un punto de partida ideal para descubrir a pie esta capital cultural. Desde los Apartamentos Mayor Centro podrá llegar fácilmente al Palacio Real, a la Gran Vía, al parque del Retiro, a numerosas tiendas y bares de tapas. 

Los apartamentos ofrecen alojamiento para 5 personas. Disponen de cocina por lo que podrá disfrutar de su estancia con total independencia. Tienen una decoración acogedora y muebles de hierro forjado y madera."
Acogedor Piso Olivar,€ 615,"Puntuación: 5,75,7",https://www.booking.com/hotel/es/acogedor-piso-olivar.es.html?label=gen173nr-1FCAEoggI46AdIClgEaEaIAQGYAQq4AQfIAQ_YAQHoAQH4AQKIAgGoAgO4ArnZiL0GwAIB0gIkMTNlMDQ2YjEtMmY1OC00MmQzLThkNmEtNTdjMjJmMzM4MWEw2AIF4AIB&aid=304142&ucfs=1&arphpl=1&checkin=2025-03-01&checkout=2025-03-07&dest_id=176&dest_type=district&group_adults=2&req_adults=2&no_rooms=1&group_children=0&req_children=0&hpos=25&hapos=326&sr_order=popularity&srpvid=46716a22cf15007f&srepoch=1738681570&all_sr_blocks=879741401_357120882_2_0_0&highlighted_blocks=879741401_357120882_2_0_0&matching_block_id=879741401_357120882_2_0_0&sr_pri_blocks=879741401_357120882_2_0_0__61468&from=searchresults,3,NA,63,"Acogedor Piso Olivar ofrece wifi gratis y se encuentra en el centro de Madrid, a 14 min a pie de Puerta de Toledo y a 1,1 km de Estación de tren de Atocha. Este apartamento está a 13 min a pie de Museo Thyssen-Bornemisza y a 1,3 km de Estación de metro Gran Vía.

Este apartamento con aire acondicionado se compone de 1 dormitorio independiente, una cocina totalmente equipada con nevera y microondas, y 1 baño. Hay toallas y ropa de cama en el apartamento.

Cerca del alojamiento hay puntos de interés como Museo Reina Sofía, Mercado de San Miguel y Plaza Mayor de Madrid. El aeropuerto (Aeropuerto Adolfo Suárez Madrid - Barajas) está a 15 km."
CH Olmedo,€ 603,"Puntuación: 6,56,5",https://www.booking.com/hotel/es/olmedo.es.html?label=gen173nr-1FCAEoggI46AdIClgEaEaIAQGYAQq4AQfIAQ_YAQHoAQH4AQKIAgGoAgO4ArnZiL0GwAIB0gIkMTNlMDQ2YjEtMmY1OC00MmQzLThkNmEtNTdjMjJmMzM4MWEw2AIF4AIB&aid=304142&ucfs=1&arphpl=1&checkin=2025-03-01&checkout=2025-03-07&dest_id=176&dest_type=district&group_adults=2&req_adults=2&no_rooms=1&group_children=0&req_children=0&hpos=1&hapos=327&sr_order=popularity&srpvid=46716a22cf15007f&srepoch=1738681572&all_sr_blocks=23556808_88204039_2_0_0&highlighted_blocks=23556808_88204039_2_0_0&matching_block_id=23556808_88204039_2_0_0&sr_pri_blocks=23556808_88204039_2_0_0__60300&from=searchresults,2,NA,1.326,"El Olmedo goza de una ubicación ideal en el corazón de Madrid, a sólo 100 metros de la Puerta del Sol. Este establecimiento ofrece alojamiento moderno con una buena relación calidad precio en un edificio del siglo XIX. Hay conexión Wi-Fi gratuita.

Las habitaciones del CH Olmedo son sencillas y elegantes. Todas disponen de baño privado y aire acondicionado. TV, caja fuerte y secador de pelo.

El Olmedo está cerca de la Plaza Mayor y la Gran Vía. El Paseo del Prado y el Triángulo del Arte también están cerca. La estación de metro Sol está a poca distancia a pie. Está bien comunicado con todas las zonas de la ciudad."
B&B HOTEL Madrid Centro Puerta del Sol,€ 1.104,"Puntuación: 9,09,0",https://www.booking.com/hotel/es/b-amp-b-puerta-del-sol.es.html?label=gen173nr-1FCAEoggI46AdIClgEaEaIAQGYAQq4AQfIAQ_YAQHoAQH4AQKIAgGoAgO4ArnZiL0GwAIB0gIkMTNlMDQ2YjEtMmY1OC00MmQzLThkNmEtNTdjMjJmMzM4MWEw2AIF4AIB&aid=304142&ucfs=1&arphpl=1&checkin=2025-03-01&checkout=2025-03-07&dest_id=176&dest_type=district&group_adults=2&req_adults=2&no_rooms=1&group_children=0&req_children=0&hpos=2&hapos=328&sr_order=popularity&srpvid=46716a22cf15007f&srepoch=1738681572&all_sr_blocks=203327202_94797139_0_0_0&highlighted_blocks=203327202_94797139_0_0_0&matching_block_id=203327202_94797139_0_0_0&sr_pri_blocks=203327202_94797139_0_0_0__110430&from_sustainable_property_sr=1&from=searchresults,3,NA,5.194,"El B&amp;B Hotel Madrid Centro Puerta del Sol está situado en Madrid, a 100 metros de la Puerta del Sol, y ofrece habitaciones con aire acondicionado y WiFi gratuita en todas las instalaciones.

Las habitaciones tienen TV de pantalla plana y baño privado con artículos de aseo gratuitos y secador de pelo.

La recepción está abierta las 24 horas.

El B&B HOTEL Madrid Centro Puerta del Sol se encuentra a 500 metros de la plaza del Callao y a 400 metros de la Plaza Mayor. El aeropuerto Adolfo Suárez Madrid-Barajas es el más cercano y queda a 13 km."
BNBHolder Relishing LA GRAN VIA,€ 969,"Puntuación: 7,87,8",https://www.booking.com/hotel/es/bnbholder-relishing-la-gran-via.es.html?label=gen173nr-1FCAEoggI46AdIClgEaEaIAQGYAQq4AQfIAQ_YAQHoAQH4AQKIAgGoAgO4ArnZiL0GwAIB0gIkMTNlMDQ2YjEtMmY1OC00MmQzLThkNmEtNTdjMjJmMzM4MWEw2AIF4AIB&aid=304142&ucfs=1&arphpl=1&checkin=2025-03-01&checkout=2025-03-07&dest_id=176&dest_type=district&group_adults=2&req_adults=2&no_rooms=1&group_children=0&req_children=0&hpos=3&hapos=329&sr_order=popularity&srpvid=46716a22cf15007f&srepoch=1738681572&all_sr_blocks=959351501_368542938_2_0_0&highlighted_blocks=959351501_368542938_2_0_0&matching_block_id=959351501_368542938_2_0_0&sr_pri_blocks=959351501_368542938_2_0_0__96933&from=searchresults,4,NA,46,"BNBHolder Relishing LA GRAN VIA se encuentra en una zona céntrica de Madrid, a poca distancia de Estación de metro Gran Vía y Museo Thyssen-Bornemisza. Ofrece equipamiento como wifi gratis, aire acondicionado, tostadora y cafetera. Este apartamento está a 1,7 km de Templo de Debod y a 14 min a pie de Royal Palace of Madrid.

El apartamento cuenta con 1 dormitorio, una cocina con nevera y microondas, y 1 baño con ducha, secador de pelo y lavadora. Hay toallas y ropa de cama en el apartamento.

Cerca del alojamiento hay puntos de interés como Gran Vía, Museo Reina Sofía y Estación de metro Plaza de España. El aeropuerto más cercano (Aeropuerto Adolfo Suárez Madrid - Barajas) está a 12 km del alojamiento."
Petite e Chic Loft para 3 en el corazon de Madrid,€ 923,"Puntuación: 7,17,1",https://www.booking.com/hotel/es/petite-e-chic-loft-para-3-en-el-corazon-de-madrid.es.html?label=gen173nr-1FCAEoggI46AdIClgEaEaIAQGYAQq4AQfIAQ_YAQHoAQH4AQKIAgGoAgO4ArnZiL0GwAIB0gIkMTNlMDQ2YjEtMmY1OC00MmQzLThkNmEtNTdjMjJmMzM4MWEw2AIF4AIB&aid=304142&ucfs=1&arphpl=1&checkin=2025-03-01&checkout=2025-03-07&dest_id=176&dest_type=district&group_adults=2&req_adults=2&no_rooms=1&group_children=0&req_children=0&hpos=4&hapos=330&sr_order=popularity&srpvid=46716a22cf15007f&srepoch=1738681572&all_sr_blocks=1230526201_395038767_3_0_0&highlighted_blocks=1230526201_395038767_3_0_0&matching_block_id=1230526201_395038767_3_0_0&sr_pri_blocks=1230526201_395038767_3_0_0__92279&from=searchresults,3,NA,18,"Petite e Chic Loft para 3 en el corazon de Madrid ofrece alojamiento bien ubicado en el centro de Madrid, a poca distancia de Parque de El Retiro y Estación de metro Gran Vía. Este apartamento está a 11 min a pie de Gran Vía y a 500 metros de Puerta del Sol.

El apartamento tiene 2 dormitorios con aire acondicionado, unazona de comedor y una zona de cocina totalmente equipada con nevera. Hay toallas y ropa de cama en el apartamento.

Cerca del alojamiento hay puntos de interés como Museo Reina Sofía, Estación de tren de Atocha y Museo Thyssen-Bornemisza. El aeropuerto más cercano (Aeropuerto Adolfo Suárez Madrid - Barajas) está a 13 km del alojamiento."
B&B HOTEL Madrid Centro Plaza Mayor,€ 1.016,"Puntuación: 8,88,8",https://www.booking.com/hotel/es/plaza-mayor.es.html?label=gen173nr-1FCAEoggI46AdIClgEaEaIAQGYAQq4AQfIAQ_YAQHoAQH4AQKIAgGoAgO4ArnZiL0GwAIB0gIkMTNlMDQ2YjEtMmY1OC00MmQzLThkNmEtNTdjMjJmMzM4MWEw2AIF4AIB&aid=304142&ucfs=1&arphpl=1&checkin=2025-03-01&checkout=2025-03-07&dest_id=176&dest_type=district&group_adults=2&req_adults=2&no_rooms=1&group_children=0&req_children=0&hpos=5&hapos=331&sr_order=popularity&srpvid=46716a22cf15007f&srepoch=1738681572&all_sr_blocks=2160012_218405334_0_0_0&highlighted_blocks=2160012_218405334_0_0_0&matching_block_id=2160012_218405334_0_0_0&sr_pri_blocks=2160012_218405334_0_0_0__101610&from_sustainable_property_sr=1&from=searchresults,2,NA,3.067,"Este hotel encantador se encuentra en el centro histórico de Madrid, en un edificio bonito del siglo XIX, en la plaza Santa Cruz, justo al lado de las plazas principales, como la Puerta del Sol y la Plaza Mayor.

El Plaza Mayor está ubicado en un edificio típico de esta zona de Madrid. Sus interiores presentan una decoración de estilo tradicional con toques de estilo contemporáneo. Disponen de paredes de piedra y de paredes revestidas de madera, realzadas con una iluminación moderna.

El suelo de parquet y las obras de arte modernas se complementan con instalaciones como conexión WiFi gratuita y TV vía satélite. Hay caja fuerte gratuita."
Minty Stay - 3 BD Lavapies,€ 1.715,"Puntuación: 7,77,7",https://www.booking.com/hotel/es/lavapies-5.es.html?label=gen173nr-1FCAEoggI46AdIClgEaEaIAQGYAQq4AQfIAQ_YAQHoAQH4AQKIAgGoAgO4ArnZiL0GwAIB0gIkMTNlMDQ2YjEtMmY1OC00MmQzLThkNmEtNTdjMjJmMzM4MWEw2AIF4AIB&aid=304142&ucfs=1&arphpl=1&checkin=2025-03-01&checkout=2025-03-07&dest_id=176&dest_type=district&group_adults=2&req_adults=2&no_rooms=1&group_children=0&req_children=0&hpos=6&hapos=332&sr_order=popularity&srpvid=46716a22cf15007f&srepoch=1738681572&all_sr_blocks=281916701_326845541_6_0_0&highlighted_blocks=281916701_326845541_6_0_0&matching_block_id=281916701_326845541_6_0_0&sr_pri_blocks=281916701_326845541_6_0_0__171490&from=searchresults,3,NA,24,"Minty Stay - 3 BD Lavapies está en el centro de Madrid, a 9 min a pie de Museo Reina Sofía y a 1 km de Estación de tren de Atocha, y ofrece wifi gratis. Este apartamento está a 12 min a pie de Puerta del Sol y a 1,3 km de Museo Thyssen-Bornemisza.

Este apartamento cuenta con 3 dormitorios, TV, zona de comedor, cocina y sala de estar. Hay toallas y ropa de cama en el apartamento.

Cerca del alojamiento hay puntos de interés como Puerta de Toledo, Plaza Mayor de Madrid y Mercado de San Miguel. El aeropuerto (Aeropuerto Adolfo Suárez Madrid - Barajas) está a 15 km."
"Escapada para 3 en Sol, conoce Concepción Jerónima",€ 933,"Puntuación: 7,57,5",https://www.booking.com/hotel/es/comfy-apartment-para-3-pax-a-1min-de-plaza-mayor.es.html?label=gen173nr-1FCAEoggI46AdIClgEaEaIAQGYAQq4AQfIAQ_YAQHoAQH4AQKIAgGoAgO4ArnZiL0GwAIB0gIkMTNlMDQ2YjEtMmY1OC00MmQzLThkNmEtNTdjMjJmMzM4MWEw2AIF4AIB&aid=304142&ucfs=1&arphpl=1&checkin=2025-03-01&checkout=2025-03-07&dest_id=176&dest_type=district&group_adults=2&req_adults=2&no_rooms=1&group_children=0&req_children=0&hpos=7&hapos=333&sr_order=popularity&srpvid=46716a22cf15007f&srepoch=1738681572&all_sr_blocks=1159444402_388660980_3_0_0&highlighted_blocks=1159444402_388660980_3_0_0&matching_block_id=1159444402_388660980_3_0_0&sr_pri_blocks=1159444402_388660980_3_0_0__93279&from=searchresults,3,NA,29,"Escapada para 3 en Sol, conoce Concepción Jerónima ofrece wifi gratis y está en el centro de Madrid, a 3 min a pie de Plaza Mayor de Madrid y a 400 metros de Mercado de San Miguel. Este apartamento está a 10 min a pie de Royal Palace of Madrid y a 1,5 km de Museo Reina Sofía.

Este apartamento con aire acondicionado consta de 1 dormitorio, una sala de estar, una cocina totalmente equipada con nevera y cafetera, y 1 baño con ducha. Hay toallas y ropa de cama en el apartamento.

Cerca del alojamiento hay puntos de interés como Puerta del Sol, Estación de metro Plaza de España y Puerta de Toledo. El aeropuerto (Aeropuerto Adolfo Suárez Madrid - Barajas) está a 14 km."
Apartamentos Day Madrid CHUECA Centro Gran Via Sol Malasaña,€ 791,"Puntuación: 6,46,4",https://www.booking.com/hotel/es/hostal-day-madrid.es.html?label=gen173nr-1FCAEoggI46AdIClgEaEaIAQGYAQq4AQfIAQ_YAQHoAQH4AQKIAgGoAgO4ArnZiL0GwAIB0gIkMTNlMDQ2YjEtMmY1OC00MmQzLThkNmEtNTdjMjJmMzM4MWEw2AIF4AIB&aid=304142&ucfs=1&arphpl=1&checkin=2025-03-01&checkout=2025-03-07&dest_id=176&dest_type=district&group_adults=2&req_adults=2&no_rooms=1&group_children=0&req_children=0&hpos=8&hapos=334&sr_order=popularity&srpvid=46716a22cf15007f&srepoch=1738681572&all_sr_blocks=183902106_402769917_2_0_0&highlighted_blocks=183902106_402769917_2_0_0&matching_block_id=183902106_402769917_2_0_0&sr_pri_blocks=183902106_402769917_2_0_0__79100&from=searchresults,3,NA,110,"Apartamentos Day Madrid CHUECA Centro Gran Via Sol Malasaña está en el centro de Madrid, a 2 min a pie de Estación de metro Gran Vía y a 200 metros de Gran Vía, y ofrece alojamiento con wifi gratis.

Cada unidad tiene baño privado, ducha, aire acondicionado, TV y nevera. También hay microondas y tostadora, además de cafetera y hervidor.

Cerca del alojamiento hay puntos de interés como Museo Thyssen-Bornemisza, Estación de metro Plaza de España y Museo Reina Sofía. El aeropuerto (Aeropuerto Adolfo Suárez Madrid - Barajas) está a 13 km."
"Hotel Urban, a Small Luxury Hotel of the World",€ 1.701,"Puntuación: 9,19,1",https://www.booking.com/hotel/es/urbanmadrid.es.html?label=gen173nr-1FCAEoggI46AdIClgEaEaIAQGYAQq4AQfIAQ_YAQHoAQH4AQKIAgGoAgO4ArnZiL0GwAIB0gIkMTNlMDQ2YjEtMmY1OC00MmQzLThkNmEtNTdjMjJmMzM4MWEw2AIF4AIB&aid=304142&ucfs=1&arphpl=1&checkin=2025-03-01&checkout=2025-03-07&dest_id=176&dest_type=district&group_adults=2&req_adults=2&no_rooms=1&group_children=0&req_children=0&hpos=9&hapos=335&sr_order=popularity&srpvid=46716a22cf15007f&srepoch=1738681572&all_sr_blocks=9050301_88181816_0_2_0&highlighted_blocks=9050301_88181816_0_2_0&matching_block_id=9050301_88181816_0_2_0&sr_pri_blocks=9050301_88181816_0_2_0__170100&from=searchresults,5,NA,1.040,"Este hotel boutique alberga una exposición de arte permanente con obras de Papúa Nueva Guinea. El Hotel Urban tiene una pequeña piscina en la azotea, una terraza abierta en verano y un bar de cócteles.

El hotel presenta un diseño con encanto. Hay gimnasio.

El hotel alberga un restaurante gastronómico: CEBO, con el dúo de estrellas Michelin Javier Sanz y Juan Sahuquillo (Oba-) como chefs principales. El bar de cócteles La terraza del Urban se halla en la azotea. El bar de cócteles Glass by Sips ofrece cócteles de autor. La terraza y la piscina de la azotea solo abren en verano.

La decoración del hotel y de las habitaciones destaca por su iluminación especial, las obras de arte oriental y el uso de madera y piedra naturales. Todas las habitaciones están insonorizadas y disponen de conexión gratuita a internet por cable y TV de pantalla plana. Todas las habitaciones disponen de TV con dispositivo ChromeCast para poder acceder a plataformas como Netflix, Amazon Prime, YouTube, etc.

El Museo Thyssen-Bornemisza queda a 200 metros. La Puerta del Sol, la principal plaza de Madrid, está a solo 300 metros."
Suite Prado,€ 1.301,"Puntuación: 8,88,8",https://www.booking.com/hotel/es/suite-prado.es.html?label=gen173nr-1FCAEoggI46AdIClgEaEaIAQGYAQq4AQfIAQ_YAQHoAQH4AQKIAgGoAgO4ArnZiL0GwAIB0gIkMTNlMDQ2YjEtMmY1OC00MmQzLThkNmEtNTdjMjJmMzM4MWEw2AIF4AIB&aid=304142&ucfs=1&arphpl=1&checkin=2025-03-01&checkout=2025-03-07&dest_id=176&dest_type=district&group_adults=2&req_adults=2&no_rooms=1&group_children=0&req_children=0&hpos=10&hapos=336&sr_order=popularity&srpvid=46716a22cf15007f&srepoch=1738681572&all_sr_blocks=9442705_374032303_2_2_0&highlighted_blocks=9442705_374032303_2_2_0&matching_block_id=9442705_374032303_2_2_0&sr_pri_blocks=9442705_374032303_2_2_0__130107&from=searchresults,4,NA,1.135,"Este hotel ofrece una ubicación muy céntrica en la ciudad, cerca del Teatro Español y del Triángulo de Oro de las Artes de Madrid, que engloba los museos del Prado, Thyssen y Reina Sofía. La Puerta del Sol queda a solo 5 minutos a pie.

El establecimiento Suite Prado cuenta con apartamentos amplios y lujosos con cocina y zona de dormitorio con salón. Los huéspedes pueden preparar su propia comida antes de salir a disfrutar de la ciudad.

Todos los apartamentos del establecimiento Suite Prado incluyen WiFi gratuita. El desayuno continental se sirve en las habitaciones.

El establecimiento Suite Prado se encuentra a poca distancia a pie de muchos de los principales lugares de interés de la ciudad. Hay recepción 24 horas."
