Name,Price,Rating,Detail Link,stars,center,num_coments,Description
ME Madrid Reina Victoria by Meliá,€ 1.574,"Puntuación: 8,48,4",https://www.booking.com/hotel/es/me-madrid-reina-victoria.es.html?label=gen173nr-1FCAEoggI46AdIClgEaEaIAQGYAQq4AQfIAQ_YAQHoAQH4AQKIAgGoAgO4ArnZiL0GwAIB0gIkMTNlMDQ2YjEtMmY1OC00MmQzLThkNmEtNTdjMjJmMzM4MWEw2AIF4AIB&aid=304142&ucfs=1&arphpl=1&checkin=2025-03-01&checkout=2025-03-07&dest_id=176&dest_type=district&group_adults=2&req_adults=2&no_rooms=1&group_children=0&req_children=0&hpos=15&hapos=167&sr_order=popularity&srpvid=46716a22cf15007f&srepoch=1738681556&all_sr_blocks=9327601_213560124_2_2_0&highlighted_blocks=9327601_213560124_2_2_0&matching_block_id=9327601_213560124_2_2_0&sr_pri_blocks=9327601_213560124_2_2_0__157400&from_sustainable_property_sr=1&from=searchresults,4,NA,2.078,"El ME Madrid Reina Victoria by Meliá es un hotel de diseño vanguardista que ocupa un edificio emblemático del siglo XIX de la histórica plaza de Santa Ana de Madrid. Ofrece habitaciones de diseño con equipo audiovisual y ducha de hidromasaje.

El hotel se encuentra a 300 metros de la Puerta del Sol. y a poca distancia a pie de la estación de metro Sevilla. Los museos Reina Sofía, Thyssen y Prado también están cerca.

Todas las habitaciones del Reina Victoria disponen de soporte para iPod, tomas de corriente compatibles con enchufes del Reino Unido y de Estados Unidos. Se ofrece caja fuerte con cargador para ordenador portátil integrado. Hay conexión WiFi gratuita disponible. Las habitaciones también tienen iluminación regulable y control de temperatura. El baño privado tiene altavoces de TV.

Algunas habitaciones tienen vistas a la plaza del Ángel o a la plaza de Santa Ana. El hotel también ofrece suites.

El Radio Rooftop Bar, en la azotea, ofrece una propuesta gastronómica para los huéspedes y organiza actividades de ocio nocturno.

El servicio de habitaciones está disponible de 08:00 a 12:00."
"San Bernabé, apartamento para 2 en las Vistillas junto a metro Puerta de Toledo",€ 504,"Puntuación: 5,35,3",https://www.booking.com/hotel/es/puerta-de-toledo-vistillas.es.html?label=gen173nr-1FCAEoggI46AdIClgEaEaIAQGYAQq4AQfIAQ_YAQHoAQH4AQKIAgGoAgO4ArnZiL0GwAIB0gIkMTNlMDQ2YjEtMmY1OC00MmQzLThkNmEtNTdjMjJmMzM4MWEw2AIF4AIB&aid=304142&ucfs=1&arphpl=1&checkin=2025-03-01&checkout=2025-03-07&dest_id=176&dest_type=district&group_adults=2&req_adults=2&no_rooms=1&group_children=0&req_children=0&hpos=16&hapos=168&sr_order=popularity&srpvid=46716a22cf15007f&srepoch=1738681556&all_sr_blocks=1019936301_374395207_2_0_0&highlighted_blocks=1019936301_374395207_2_0_0&matching_block_id=1019936301_374395207_2_0_0&sr_pri_blocks=1019936301_374395207_2_0_0__50358&from=searchresults,NA,NA,36,"San Bernabé, apartamento para 2 en las Vistillas junto a metro Puerta de Toledo está en el centro de Madrid, a 7 min a pie de Puerta de Toledo y a 1,1 km de Mercado de San Miguel, y ofrece wifi gratis. Este apartamento está a 13 min a pie de Royal Palace of Madrid y a 1,9 km de Gran Vía.

Este apartamento con aire acondicionado consta de 1 dormitorio, una sala de estar, una cocina totalmente equipada con nevera y hervidor, y 1 baño con ducha y artículos de aseo gratuitos. Hay toallas y ropa de cama en el apartamento.

En la recepción 24 horas se hablan varios idiomas, como inglés y español.

Cerca del alojamiento hay puntos de interés como Plaza Mayor de Madrid, Puerta del Sol y Estación de metro Plaza de España. El aeropuerto (Aeropuerto Adolfo Suárez Madrid - Barajas) está a 16 km."
Generator Madrid,€ 974,"Puntuación: 8,28,2",https://www.booking.com/hotel/es/generator-madrid.es.html?label=gen173nr-1FCAEoggI46AdIClgEaEaIAQGYAQq4AQfIAQ_YAQHoAQH4AQKIAgGoAgO4ArnZiL0GwAIB0gIkMTNlMDQ2YjEtMmY1OC00MmQzLThkNmEtNTdjMjJmMzM4MWEw2AIF4AIB&aid=304142&ucfs=1&arphpl=1&checkin=2025-03-01&checkout=2025-03-07&dest_id=176&dest_type=district&group_adults=2&req_adults=2&no_rooms=1&group_children=0&req_children=0&hpos=17&hapos=169&sr_order=popularity&srpvid=46716a22cf15007f&srepoch=1738681556&all_sr_blocks=309284430_139595413_0_2_0&highlighted_blocks=309284430_139595413_0_2_0&matching_block_id=309284430_139595413_0_2_0&sr_pri_blocks=309284430_139595413_0_2_0__97380&from_sustainable_property_sr=1&from=searchresults,NA,NA,11.669,"El Generator Madrid ofrece alojamiento situado a 1 minuto a pie de la Gran Vía. Además, alberga una terraza en la azotea con bar y 2 bañeras de hidromasaje.

También dispone de zonas comunes decoradas en estilo industrial, como el salón compartido, donde los huéspedes pueden ver la TV, leer o escuchar sesiones diarias de DJ.

Las habitaciones del Generator Madrid son luminosas, presentan una decoración vanguardista que combina elementos clásicos y modernos y pueden ser privadas o compartidas. Todas ellas incluyen baño con ducha y aire acondicionado. 

Las habitaciones compartidas constan de literas con puerto USB, luz nocturna, zona de almacenamiento y taquilla privada. Se proporciona ropa de cama. Las toallas se pueden alquilar en la recepción. 

Las habitaciones dobles estándar con 2 camas individuales y las habitaciones familiares incluyen camas de diferentes tipos y baño privado con artículos de aseo gratuitos, toallas y secador de pelo.

El establecimiento sirve varias opciones de desayuno. También alberga un restaurante americano-mexicano, donde se organizan actividades culturales todos los días. 

Además, se proporciona aparcamiento privado y consigna de equipaje por un suplemento. 

El Generator Madrid se encuentra a 750 metros de la Plaza Mayor y a 300 metros del palacio Real. 

La estación de metro más cercana es la de Santo Domingo (línea 2) Asimismo, el albergue se halla a 23 km del aeropuerto de Madrid-Barajas."
MH Apartments Central Madrid,€ 1.488,"Puntuación: 8,98,9",https://www.booking.com/hotel/es/mh-apartments-central-madrid.es.html?label=gen173nr-1FCAEoggI46AdIClgEaEaIAQGYAQq4AQfIAQ_YAQHoAQH4AQKIAgGoAgO4ArnZiL0GwAIB0gIkMTNlMDQ2YjEtMmY1OC00MmQzLThkNmEtNTdjMjJmMzM4MWEw2AIF4AIB&aid=304142&ucfs=1&arphpl=1&checkin=2025-03-01&checkout=2025-03-07&dest_id=176&dest_type=district&group_adults=2&req_adults=2&no_rooms=1&group_children=0&req_children=0&hpos=18&hapos=170&sr_order=popularity&srpvid=46716a22cf15007f&srepoch=1738681556&all_sr_blocks=360655202_0_2_0_0&highlighted_blocks=360655202_0_2_0_0&matching_block_id=360655202_0_2_0_0&sr_pri_blocks=360655202_0_2_0_0__148809&from=searchresults,4,NA,1.750,"El MH Apartments Central Madrid, situado en Madrid, frente a la plaza Tirso de Molina y a solo 500 metros de la Puerta del Sol, ofrece amplios apartamentos de lujo con WiFi gratuita.

Todos los apartamentos tienen una sala de estar con sofá y TV de pantalla plana vía satélite. La cocina está bien equipada e incluye lavavajillas, lavadora, microondas, tostadora y set de té y café. Los alojamientos disponen de 1 o 2 baños privados con ducha.

Los apartamentos están situados en el animado centro de Madrid, cerca de numerosos restaurantes, bares y tiendas.

El Museo Reina Sofía y el Palacio Real están a solo 15 minutos a pie. El aeropuerto Adolfo Suárez Madrid-Barajas es el más cercano y queda a 14 km."
Hostal Edreira,€ 815,"Puntuación: 8,78,7",https://www.booking.com/hotel/es/hostal-edreira-madrid.es.html?label=gen173nr-1FCAEoggI46AdIClgEaEaIAQGYAQq4AQfIAQ_YAQHoAQH4AQKIAgGoAgO4ArnZiL0GwAIB0gIkMTNlMDQ2YjEtMmY1OC00MmQzLThkNmEtNTdjMjJmMzM4MWEw2AIF4AIB&aid=304142&ucfs=1&arphpl=1&checkin=2025-03-01&checkout=2025-03-07&dest_id=176&dest_type=district&group_adults=2&req_adults=2&no_rooms=1&group_children=0&req_children=0&hpos=19&hapos=171&sr_order=popularity&srpvid=46716a22cf15007f&srepoch=1738681556&all_sr_blocks=46632803_0_2_0_0&highlighted_blocks=46632803_0_2_0_0&matching_block_id=46632803_0_2_0_0&sr_pri_blocks=46632803_0_2_0_0__81526&from=searchresults,2,NA,1.982,"El Hostal Edreira, situado en el centro de Madrid, a 10 minutos a pie de los museos de El Prado, Reina Sofía y Thyssen-Bornemisza, ofrece servicio de recepción las 24 horas y habitaciones con aire acondicionado y conexión Wi-Fi gratuita.

Las habitaciones del Hostal Edreira presentan una decoración funcional y cuentan con TV de pantalla plana.

El establecimiento se encuentra a unos 10 minutos a pie de las conocidas plazas de la Puerta del Sol y la Plaza Mayor. Además, encontrará numerosos bares, tiendas y restaurantes en los alrededores.

El hostal está a 50 metros de la estación de metro Antón Martín y a 10 minutos a pie de la estación de AVE de Atocha, que también ofrece autobuses que enlazan con el aeropuerto de Barajas."
Hotel Casón del Tormes by HappyCulture,€ 1.106,"Puntuación: 8,68,6",https://www.booking.com/hotel/es/cason-del-tormes.es.html?label=gen173nr-1FCAEoggI46AdIClgEaEaIAQGYAQq4AQfIAQ_YAQHoAQH4AQKIAgGoAgO4ArnZiL0GwAIB0gIkMTNlMDQ2YjEtMmY1OC00MmQzLThkNmEtNTdjMjJmMzM4MWEw2AIF4AIB&aid=304142&ucfs=1&arphpl=1&checkin=2025-03-01&checkout=2025-03-07&dest_id=176&dest_type=district&group_adults=2&req_adults=2&no_rooms=1&group_children=0&req_children=0&hpos=20&hapos=172&sr_order=popularity&srpvid=46716a22cf15007f&srepoch=1738681556&all_sr_blocks=1488201_95139630_0_2_0&highlighted_blocks=1488201_95139630_0_2_0&matching_block_id=1488201_95139630_0_2_0&sr_pri_blocks=1488201_95139630_0_2_0__110600&from=searchresults,3,NA,4.319,"El Hotel Casón del Tormes by HappyCulture está en una zona tranquila del centro de Madrid, entre la plaza de España y el Palacio Real. Ofrece habitaciones amplias con mucha luz natural.

Las habitaciones del Hotel Casón del Tormes by HappyCulture disponen de baño privado, TV vía satélite, frigorífico, calefacción y aire acondicionado.

En el salón Los Madroños se sirve un desayuno buffet. Además, el establecimiento goza de una ubicación céntrica y se encuentra a poca distancia a pie de diversos bares y restaurantes.

El hotel se sitúa a solo 100 metros de la parada de metro de Plaza de España, que enlaza con el Triángulo del Arte y el Museo del Prado. Los autobuses turísticos salen de la famosa Gran Vía, ubicada a 1 minuto a pie del establecimiento.

El Hotel Casón del Tormes by HappyCulture proporciona servicios prácticos, como mostrador de información turística y recepción las 24 horas En la recepción también se ofrece servicio de cambio de divisas. Hay conexión WiFi gratuita."
Hostal Charlotte-Gran Vía,€ 1.324,"Puntuación: 7,97,9",https://www.booking.com/hotel/es/hostal-charlotte-madrid123.es.html?label=gen173nr-1FCAEoggI46AdIClgEaEaIAQGYAQq4AQfIAQ_YAQHoAQH4AQKIAgGoAgO4ArnZiL0GwAIB0gIkMTNlMDQ2YjEtMmY1OC00MmQzLThkNmEtNTdjMjJmMzM4MWEw2AIF4AIB&aid=304142&ucfs=1&arphpl=1&checkin=2025-03-01&checkout=2025-03-07&dest_id=176&dest_type=district&group_adults=2&req_adults=2&no_rooms=1&group_children=0&req_children=0&hpos=21&hapos=173&sr_order=popularity&srpvid=46716a22cf15007f&srepoch=1738681556&all_sr_blocks=346677003_397572623_2_2_0&highlighted_blocks=346677003_397572623_2_2_0&matching_block_id=346677003_397572623_2_2_0&sr_pri_blocks=346677003_397572623_2_2_0__132360&from=searchresults,NA,NA,1.700,"Hostal Charlotte-Gran Vía es un alojamiento muy bien situado en el centro de Madrid que ofrece habitaciones con aire acondicionado, restaurante y wifi gratis. El alojamiento está a unos 5 min a pie de Estación de metro Gran Vía, a 1,3 km de Museo Thyssen-Bornemisza y a 6 min a pie de Estación de metro Plaza de España. Este alojamiento libre de humo se encuentra a 2 min a pie de Gran Vía.

En el albergue, cada habitación tiene escritorio, TV de pantalla plana, baño privado, ropa de cama y toallas. Cada habitación cuenta con cafetera, algunas ofrecen terraza y otras también ofrecen vistas a la ciudad. Las habitaciones incluyen caja fuerte.

El desayuno está disponible todos los días e incluye opciones continentales, vegetarianas o veganas.

El personal, que habla inglés y español, ofrece información en la recepción.

Cerca del alojamiento hay puntos de interés como Templo de Debod, Royal Palace of Madrid y Mercado de San Miguel. El aeropuerto (Aeropuerto Adolfo Suárez Madrid - Barajas) está a 13 km."
Casa Huésped Magdalena,€ 407,"Puntuación: 5,85,8",https://www.booking.com/hotel/es/pension-magdalena.es.html?label=gen173nr-1FCAEoggI46AdIClgEaEaIAQGYAQq4AQfIAQ_YAQHoAQH4AQKIAgGoAgO4ArnZiL0GwAIB0gIkMTNlMDQ2YjEtMmY1OC00MmQzLThkNmEtNTdjMjJmMzM4MWEw2AIF4AIB&aid=304142&ucfs=1&arphpl=1&checkin=2025-03-01&checkout=2025-03-07&dest_id=176&dest_type=district&group_adults=2&req_adults=2&no_rooms=1&group_children=0&req_children=0&hpos=22&hapos=174&sr_order=popularity&srpvid=46716a22cf15007f&srepoch=1738681556&all_sr_blocks=31994504_88207262_0_0_0_466748&highlighted_blocks=31994504_88207262_0_0_0_466748&matching_block_id=31994504_88207262_0_0_0_466748&sr_pri_blocks=31994504_88207262_0_0_0_466748_40680&from=searchresults,1,NA,1.984,"La Casa Huésped Magdalena está a solo 100 metros de la estación de metro Antón Martín, en el centro de Madrid. Está a 8 minutos a pie de la Puerta del Sol y a 10 minutos a pie de la estación de tren de Atocha.

Las habitaciones del Magdalena presentan una decoración sencilla y disponen de aire acondicionado, calefacción central y ventilador. Todas tienen baño privado. 

El personal de recepción puede facilitar información turística sobre Madrid. La Casa Huésped Magdalena se encuentra a unos 10 minutos a pie del parque del Retiro y a 350 metros de la calle Huertas. Los museos del Prado, Reina Sofía y Thyssen están a unos 10 minutos a pie.

La Casa Huésped Magdalena se encuentra en una tercera planta sin ascensor. Está estrictamente prohibido fumar en toda la propiedad y se cobrará un cargo de 150 euros como penalización."
Intimate Studio in the heart of Madrid,€ 744,Puntuación: 1010,https://www.booking.com/hotel/es/intimate-studio-in-the-heart-of-madrid.es.html?label=gen173nr-1FCAEoggI46AdIClgEaEaIAQGYAQq4AQfIAQ_YAQHoAQH4AQKIAgGoAgO4ArnZiL0GwAIB0gIkMTNlMDQ2YjEtMmY1OC00MmQzLThkNmEtNTdjMjJmMzM4MWEw2AIF4AIB&aid=304142&ucfs=1&arphpl=1&checkin=2025-03-01&checkout=2025-03-07&dest_id=176&dest_type=district&group_adults=2&req_adults=2&no_rooms=1&group_children=0&req_children=0&hpos=23&hapos=175&sr_order=popularity&srpvid=46716a22cf15007f&srepoch=1738681556&all_sr_blocks=1323017101_404971766_0_0_0&highlighted_blocks=1323017101_404971766_0_0_0&matching_block_id=1323017101_404971766_0_0_0&sr_pri_blocks=1323017101_404971766_0_0_0__74432&from=searchresults,3,NA,NA,"Intimate Studio in the heart of Madrid ofrece wifi gratis y está en el centro de Madrid, a 13 min a pie de Gran Vía y a 1,3 km de Estación de metro Gran Vía. Este apartamento está a 18 min a pie de Mercado de San Miguel y a 3 km de Museo Thyssen-Bornemisza.

Este apartamento tiene aire acondicionado y cuenta con 1 dormitorio, TV de pantalla plana y cocina.

Cerca del alojamiento hay puntos de interés como Estación de metro Plaza de España, Templo de Debod y Royal Palace of Madrid. El aeropuerto (Aeropuerto Adolfo Suárez Madrid - Barajas) está a 18 km."
Apartamentos Day Madrid SAN ANTONIO Centro Gran Via Sol Malasaña,€ 921,"Puntuación: 7,27,2",https://www.booking.com/hotel/es/gran-via-madrid.es.html?label=gen173nr-1FCAEoggI46AdIClgEaEaIAQGYAQq4AQfIAQ_YAQHoAQH4AQKIAgGoAgO4ArnZiL0GwAIB0gIkMTNlMDQ2YjEtMmY1OC00MmQzLThkNmEtNTdjMjJmMzM4MWEw2AIF4AIB&aid=304142&ucfs=1&arphpl=1&checkin=2025-03-01&checkout=2025-03-07&dest_id=176&dest_type=district&group_adults=2&req_adults=2&no_rooms=1&group_children=0&req_children=0&hpos=24&hapos=176&sr_order=popularity&srpvid=46716a22cf15007f&srepoch=1738681556&all_sr_blocks=124280303_402772470_4_0_0&highlighted_blocks=124280303_402772470_4_0_0&matching_block_id=124280303_402772470_4_0_0&sr_pri_blocks=124280303_402772470_4_0_0__92076&from=searchresults,3,NA,134,"Apartamentos Day Madrid SAN ANTONIO Centro Gran Via Sol Malasaña ofrece alojamiento con wifi gratis, cocina, nevera, horno y microondas a 500 metros del centro de Madrid.

Cada unidad tiene baño privado, ducha, aire acondicionado, TV y fogones. También hay tostadora, además de cafetera y hervidor.

Cerca del alojamiento hay puntos de interés como Gran Vía, Estación de metro Gran Vía y Museo Thyssen-Bornemisza. El aeropuerto (Aeropuerto Adolfo Suárez Madrid - Barajas) está a 13 km."
Collection Plaza de España,€ 1.052,"Puntuación: 7,27,2",https://www.booking.com/hotel/es/collection-plaza-de-espana.es.html?label=gen173nr-1FCAEoggI46AdIClgEaEaIAQGYAQq4AQfIAQ_YAQHoAQH4AQKIAgGoAgO4ArnZiL0GwAIB0gIkMTNlMDQ2YjEtMmY1OC00MmQzLThkNmEtNTdjMjJmMzM4MWEw2AIF4AIB&aid=304142&ucfs=1&arphpl=1&checkin=2025-03-01&checkout=2025-03-07&dest_id=176&dest_type=district&group_adults=2&req_adults=2&no_rooms=1&group_children=0&req_children=0&hpos=25&hapos=177&sr_order=popularity&srpvid=46716a22cf15007f&srepoch=1738681556&all_sr_blocks=863118301_354319840_2_0_0&highlighted_blocks=863118301_354319840_2_0_0&matching_block_id=863118301_354319840_2_0_0&sr_pri_blocks=863118301_354319840_2_0_0__105157&from=searchresults,3,NA,844,"Collection Plaza de España se encuentra en el centro de Madrid, a 9 min a pie de Gran Vía y a 1 km de Estación de metro Gran Vía, y ofrece alojamiento con wifi gratis y zona de estar.

El alojamiento tiene aire acondicionado, zona de cocina totalmente equipada y con zona de comedor, TV de pantalla plana y baño privado con bañera o ducha, artículos de aseo gratuitos y secador de pelo. También hay nevera, microondas y hervidor.

Cerca del alojamiento hay puntos de interés como Estación de metro Plaza de España, Templo de Debod y Royal Palace of Madrid. El aeropuerto (Aeropuerto Adolfo Suárez Madrid - Barajas) está a 19 km."
BNBHolder Boutique SOL,€ 785,"Puntuación: 7,57,5",https://www.booking.com/hotel/es/bnbholder-boutique-sol-madrid.es.html?label=gen173nr-1FCAEoggI46AdIClgEaEaIAQGYAQq4AQfIAQ_YAQHoAQH4AQKIAgGoAgO4ArnZiL0GwAIB0gIkMTNlMDQ2YjEtMmY1OC00MmQzLThkNmEtNTdjMjJmMzM4MWEw2AIF4AIB&aid=304142&ucfs=1&arphpl=1&checkin=2025-03-01&checkout=2025-03-07&dest_id=176&dest_type=district&group_adults=2&req_adults=2&no_rooms=1&group_children=0&req_children=0&hpos=1&hapos=178&sr_order=popularity&srpvid=46716a22cf15007f&srepoch=1738681558&all_sr_blocks=769676901_334752639_2_0_0&highlighted_blocks=769676901_334752639_2_0_0&matching_block_id=769676901_334752639_2_0_0&sr_pri_blocks=769676901_334752639_2_0_0__78489&from=searchresults,3,NA,422,"BNBHolder Boutique SOL se encuentra en el centro de Madrid, a 3 min a pie de Estación de metro Gran Vía, ydispone de habitaciones con aire acondicionado y wifi gratis. El alojamiento se encuentra a 10 min a pie de Museo Thyssen-Bornemisza, a 1,1 km de Estación de metro Plaza de España y a 1,8 km de Parque de El Retiro. Este alojamiento libre de humo está a 4 min a pie de Gran Vía.

Las habitaciones de este alojamiento están equipadas con cafetera. Todas las habitaciones tienen baño privado, secador de pelo y ropa de cama.

Cerca del alojamiento hay puntos de interés como Museo Reina Sofía, Royal Palace of Madrid y Mercado de San Miguel. El aeropuerto (Aeropuerto Adolfo Suárez Madrid - Barajas) está a 13 km."
Francisco I Boutique,€ 1.563,"Puntuación: 9,09,0",https://www.booking.com/hotel/es/francisco-i.es.html?label=gen173nr-1FCAEoggI46AdIClgEaEaIAQGYAQq4AQfIAQ_YAQHoAQH4AQKIAgGoAgO4ArnZiL0GwAIB0gIkMTNlMDQ2YjEtMmY1OC00MmQzLThkNmEtNTdjMjJmMzM4MWEw2AIF4AIB&aid=304142&ucfs=1&arphpl=1&checkin=2025-03-01&checkout=2025-03-07&dest_id=176&dest_type=district&group_adults=2&req_adults=2&no_rooms=1&group_children=0&req_children=0&hpos=2&hapos=179&sr_order=popularity&srpvid=46716a22cf15007f&srepoch=1738681558&all_sr_blocks=9330102_199241824_0_1_0&highlighted_blocks=9330102_199241824_0_1_0&matching_block_id=9330102_199241824_0_1_0&sr_pri_blocks=9330102_199241824_0_1_0__156274&from=searchresults,4,NA,3.787,"El establecimiento Francisco I Boutique está situado a 250 metros de la plaza Mayor y de la Puerta del Sol de Madrid. Ofrece recepción 24 horas y habitaciones sencillas con baño privado, TV y WiFi gratuita.

Todos los días se sirve un desayuno buffet ligero en el Hotel Francisco I Boutique. En las calles de los alrededores hay una amplia variedad de bares y restaurantes.

En la recepción del hotel Francisco se puede obtener información sobre la ciudad. También se pueden alquilar coches y reservar un servicio de enlace con el aeropuerto.

El Francisco I Boutique está a solo 500 metros del Palacio Real y los jardines de Sabatini, mientras que el Museo del Prado se encuentra a menos de 20 minutos a pie. La estación de metro de Ópera está a 2 minutos a pie del hotel.

El aeropuerto Adolfo Suárez de Madrid-Barajas es el más cercano y se encuentra a 14 km."
Alhambra Suites,€ 960,"Puntuación: 8,18,1",https://www.booking.com/hotel/es/hostal-alhambra-suites.es.html?label=gen173nr-1FCAEoggI46AdIClgEaEaIAQGYAQq4AQfIAQ_YAQHoAQH4AQKIAgGoAgO4ArnZiL0GwAIB0gIkMTNlMDQ2YjEtMmY1OC00MmQzLThkNmEtNTdjMjJmMzM4MWEw2AIF4AIB&aid=304142&ucfs=1&arphpl=1&checkin=2025-03-01&checkout=2025-03-07&dest_id=176&dest_type=district&group_adults=2&req_adults=2&no_rooms=1&group_children=0&req_children=0&hpos=3&hapos=180&sr_order=popularity&srpvid=46716a22cf15007f&srepoch=1738681558&all_sr_blocks=4974302_370341489_2_1_0&highlighted_blocks=4974302_370341489_2_1_0&matching_block_id=4974302_370341489_2_1_0&sr_pri_blocks=4974302_370341489_2_1_0__96000&from=searchresults,3,NA,3.176,"El Alhambra Suites está muy bien situado en Madrid, cerca de lugares de interés como la Puerta del Sol, el mercado de San Miguel, el Museo Thyssen-Bornemisza y el Museo del Prado. El establecimiento ofrece wifi gratuita (solo en algunas habitaciones) y TV de pantalla plana en las habitaciones.

Ocupa un edificio histórico del siglo XIX. Combina una decoración clásica española con comodidades modernas. Las habitaciones tienen un bonito diseño en blanco y negro y cuentan con wifi gratuita, aire acondicionado y calefacción (solo en algunas habitaciones)

Se sirve un desayuno buffet en el restaurante cafetería del alojamiento, situado a pocos metros del edificio principal. También se preparan platos típicos españoles.

Cuenta con mostrador de información turística. El Alhambra Suites está cerca de lugares de interés como la plaza Mayor, el Palacio Real y el Teatro Español."
Smartrental Collection Gran Vía Centric,€ 1.463,"Puntuación: 8,98,9",https://www.booking.com/hotel/es/gv-centric.es.html?label=gen173nr-1FCAEoggI46AdIClgEaEaIAQGYAQq4AQfIAQ_YAQHoAQH4AQKIAgGoAgO4ArnZiL0GwAIB0gIkMTNlMDQ2YjEtMmY1OC00MmQzLThkNmEtNTdjMjJmMzM4MWEw2AIF4AIB&aid=304142&ucfs=1&arphpl=1&checkin=2025-03-01&checkout=2025-03-07&dest_id=176&dest_type=district&group_adults=2&req_adults=2&no_rooms=1&group_children=0&req_children=0&hpos=4&hapos=181&sr_order=popularity&srpvid=46716a22cf15007f&srepoch=1738681558&all_sr_blocks=434326302_130297571_2_34_0&highlighted_blocks=434326302_130297571_2_34_0&matching_block_id=434326302_130297571_2_34_0&sr_pri_blocks=434326302_130297571_2_34_0__146273&from=searchresults,4,NA,4.474,"El SmartRental Collection Gran Via Centric se encuentra en el centro de Madrid, en plena Gran Vía y frente a la plaza del Callao, y ofrece alojamiento con WiFi gratuita.

Los alojamientos disponen de aire acondicionado, TV de pantalla plana, cocina totalmente equipada y baño privado con ducha y artículos de aseo gratuitos. También incluyen zona de salón comedor.

Algunos apartamentos cuentan con terraza.

El establecimiento proporciona servicio de alquiler de coches y servicio de enlace con el aeropuerto.

El SmartRental Collection Gran Via Centric está situado a 1,5 km del palacio Real y a 1,3 km del Museo Thyssen-Bornemisza. El alojamiento se halla a 19 km del aeropuerto Adolfo Suárez Madrid-Barajas, el más cercano.

El establecimiento puede solicitar el pago de un depósito a la entrada."
Oriente Suites,€ 1.037,"Puntuación: 8,88,8",https://www.booking.com/hotel/es/oriente-suites.es.html?label=gen173nr-1FCAEoggI46AdIClgEaEaIAQGYAQq4AQfIAQ_YAQHoAQH4AQKIAgGoAgO4ArnZiL0GwAIB0gIkMTNlMDQ2YjEtMmY1OC00MmQzLThkNmEtNTdjMjJmMzM4MWEw2AIF4AIB&aid=304142&ucfs=1&arphpl=1&checkin=2025-03-01&checkout=2025-03-07&dest_id=176&dest_type=district&group_adults=2&req_adults=2&no_rooms=1&group_children=0&req_children=0&hpos=5&hapos=182&sr_order=popularity&srpvid=46716a22cf15007f&srepoch=1738681558&all_sr_blocks=173626802_195284085_2_0_0&highlighted_blocks=173626802_195284085_2_0_0&matching_block_id=173626802_195284085_2_0_0&sr_pri_blocks=173626802_195284085_2_0_0__103700&from=searchresults,3,NA,332,"Oriente Suites ofrece alojamiento con wifi gratis, zona de cocina, nevera, microondas y tostadora a 300 metros del centro de Madrid.

Hay un baño privado con bañera o ducha y artículos de aseo gratuitos en cada unidad, además de secador de pelo.

Cerca del alojamiento hay puntos de interés como Mercado de San Miguel, Plaza Mayor de Madrid y Puerta del Sol. El aeropuerto (Aeropuerto Adolfo Suárez Madrid - Barajas) está a 14 km."
